movie_id,movie_title,cast
25229,Sex and the City 2,   Carrie Bradshaw  feecc      Sarah Jessica Parker      Charlotte York  feeccd      Kristin Davis      Miranda Hobbes  feecd      Cynthia Nixon      Samantha Jones  feecd      Kim Cattrall      Mr. Big  dc      Chris Noth      Steve Brady  feecd      David Eigenberg      Harry Goldenblatt  feecdd      Evan Handler      Lily York Goldenblatt  feece      Alexandra Fong      Lily York Goldenblatt  feece      Parker Fong      Anthony Marantino  feece      Mario Cantone      Stanford Blatch  feeced      Willie Garson      Nicky  feecf      Noah Mills      Herself  feecf      Liza Minnelli      Band Leader  feecf      Billy Stritch      Erin  feecfd      Alice Eve      Jerry 'Smith' Jerrod  feec      Jason Lewis      Rikard Spirit  feec      Max Ryan      Magda  feec      Lynn Cohen        feecd      Amira Mor      Mahmud  feec      Dhaffer L'Abidine      Aidan Shaw  feec      John Corbett      Annesha  feec      Raya Meddine      Patience  feecd      Jennifer Ferrin      VIP Party Patron  ccacac      Tet Wada      Himself  dcdcaf      Tim Gunn      Carmen Garc\ueda Carri\ufn  ddecab      Pen\uelope Cruz      Herself  deac      Miley Cyrus      Mr. Safir Hotel Manager  dc      Omid Djalili      Herself  dacafac      Tuesday Knight      Reginald  bfebbc      Norm Lewis      Allie  cccaff      Megan Boone      Kevin  ccafb      Neal Bledsoe  ]
15080,The Road to El Dorado,   Miguel  (voice)  fecccb      Kenneth Branagh      Tulio (voice)  fecccf      Kevin Kline      Chel (voice)  feccd      Rosie Perez      Tzekel-Kan (voice)  feccd      Armand Assante      Chief (voice)  deecacfcc      Edward James Olmos      Cortes (voice)  debcafff      Jim Cummings      Altivo (voice)  dedbed      Frank Welker      Zaragoza (voice)  decacfef      Tobin Bell      Narrator (voice)  decac      Elton John      Acolyte (voice)  de      Duncan Marjoribanks      Kid # (voice)  defba      Elijah Chiang      Kid # (voice)  deafa      Cyrus Shaki-Khan  ]
32610,Ice Age: Continental Drift,   Sid (voice)  fecaff      John Leguizamo      Manny (voice)  fecaffb      Ray Romano      Scrat (voice)  fecaff      Chris Wedge      Diego (voice)  fecafff      Denis Leary      Crash (voice)  fecaff      Seann William Scott      Shira (voice)  fecaff      Jennifer Lopez      Ellie (voice)  fecaffd      Queen Latifah      Captain Gutt (voice)  fecaff      Peter Dinklage      Flynn (voice)  fecaff      Nick Frost      Louis (voice)  fecaff      Josh Gad      Steffie (voice)  fecaffd      Nicki Minaj      Katie (voice)  fecaff      Heather Morris      Granny (voice)  fecaff      Wanda Sykes      Milton / Hunky Siren (voice)  fecaff      Alan Tudyk      Raz (voice)  fecaffd      Rebel Wilson      Squint (voice)  fecaff      Aziz Ansari      Eunice (voice)  fecaff      Joy Behar      Creature Siren (voice)  daeab      Christopher Campbell      Additional Voices  defac      Jason Harris      Peaches  acaa      Keke Palmer      Scratte  cafa      Karen Disher      Eddie  bcaf      Josh Peck      Ethan  becae      Drake      Silas  eafcabe      Alain Chabat      Gupta  fccaed      Kunal Nayyar      Additional Voices (voice)  efceec      Lucas Leguizamo      Additional Voices (voice)  efdbdfff      Allegra Leguizamo      Female Siren (voice)  daef      Ester Dean      Dumb Mammoth / Various (voice)  daeef      Jason Fricchione      Marshall (voice)  daeacaca      Ben Gleib      Beaver (voice)  daefe      George Jacobs      Panicked Start (voice)  daeaccacbbb      James Palumbo      Buck (voice)  daecfb      Simon Pegg      Meghan (voice)  daedebb      Alexandra Romano      Uncle Fungus (voice)  daeedd      Eddie 'Piolin' Sotelo      Ariscratle (voice)  daeeecacaa      Patrick Stewart      Additional Voices (voice)  daeeba      Brian Scott McFadden  ]
26896,Cinderella,   Cinderella  edeac      Lily James      Lady Tremaine  feaeacce      Cate Blanchett      Prince \Kit\ Charming  feaeacce      Richard Madden      Fairy Godmother  feaeacce      Helena Bonham Carter      Grand Duke  edceabd      Stellan Skarsg\uerd      Anastasia Tremaine  feaeacce      Holliday Grainger      Captain  edeac      Nonso Anozie      Cinderella's Father  caaa      Ben Chaplin      Cinderella's Mother  edeacc      Hayley Atwell      Baron  ebeacaaac      Richard McCabe      Master Phineus  bdcca      Rob Brydon      Chief Guard Cassius  bec      Laurie Calvert      Princess Mei Mei  ccaaee      Leila Wong      Prince's Retinue Member  ebdafef      Nari Blair-Mangat      Trooper  eccaadb      Adetomiwa Edun      Palace Official  eddb      Joshua McGuire      Halberdier  edcac      Matthew Steer      Slipper Lady  eddd      Ella Smith      Princess Valentina (uncredited)  ed      Elina Alminas      Fencer  ed      Andrew Fitch      Ball Dancer (uncredited)  edfcaebd      Jo\ueo Costa Menezes      Ball Guest (uncredited)  edcafe      Gino Picciano      Wealthy Maiden (uncredited)  edcafcd      Charlotte Worwood      Ball Guest (uncredited)  edcade      Zizi Strallen      Gentleman (uncredited)  edfca      Barrie Martin      Townsperson / Courtier / Ball Guest  (uncredited)  edcaebf      Georgie-May Tearle      The King  edeac      Derek Jacobi      Drizella Tremaine  feaeacced      Sophie McShera      Royal Crier  dfcacc      Alex MacQueen      Ball Guest (uncredited)  edce      Melissa Galloway      Royal Crier's Assistant  eda      Joseph Kloska      King's Doctor  edadd      Michael Jenn      Palace Guard (uncredited)  ede      Joe Kennard      Ballroom Palace Guard  edcaeb      Josh O'Connor      Cinderella ( years)  bdec      Eloise Webb      Princess Chelina of Zaragosa  edd      Jana Perez      Goose Coachman  ebcaeafe      Gareth Mason      Lizard Footman  eda      Tom Edden      Slipper Lady  edaf      Mimi Ndiweni      Slipper Lady  edcafc      Laura Elsworthy      Slipper Lady  edcafc      Ann Davies      Lord Veneering  eddf      Gerard Horan      Cook  edcac      Katie West      Farmer  becaeedc      Paul Hunter      Gardener  edcad      Daniel Tuite      Maid  eda      Anjana Vasan      Stable Boy  edcaeb      Stuart Neal      Prince's Retinue Member  edcaeb      Andy Apollo      Prince's Retinue Member  ede      Jonny Owen-Last      Ball Guest  edcafca      Sean Francis George      Fencer (as Gregory Lockett)  edc      Greg Lockett      Visiting Dignitary (uncredited)  edcada      Bhanu Alley      Townsperson / Ball Guest (uncredited)  edcaeda      Scherrikar Bell      Latin Noblewoman (uncredited)  eda      Francesca Bennett      Ball Guest (uncredited)  edacadc      Sophie-Anna Brough      Ball Dancer (uncredited)  edbcaf      Arielle Campbell      Townsperson / Onion Seller (uncredited)  edb      Janet Dawe      Townsperson (uncredited)  edbcaf      Robert J. Fraser      Townsperson (uncredited)  edccafa      Riley Halden      Princess Sasia of Arabia (uncredited)  edccaeda      Monique Geraghty      Courtier Guest (uncredited)  eddae      John W.G. Harley      Palace Footman (uncredited)  eddcafc      Ant Henson      Nobleman (uncredited)  eddec      Rajesh Kalhan      Ball Guest (uncredited)  edeca      Sayed Kassem      Ball Guest (uncredited)  edecaeda      Victoria Ann Kenway      Palace Guard (uncredited)  edfa      Alex Marek      Palace Footman (uncredited)  edfda      Henry McCook      Hopeful Maiden (uncredited)  edae      Bronwyn Pearson      Palace Guard (uncredited)  eda      Jd Roth-round      Townsperson / Tavern Drinker (uncredited)  edcaf      Julian Seager      Market Trader (uncredited)  edae      Sarah Sharman      Nicolas Golding (uncredited)  edcaedac      Drew Sheridan-Wheeler      Fisherman (uncredited)  edab      Peter Stacey      Footman (uncredited)  ed      Tom Swacha      Slipper Maiden / Townsperson       (uncredited)  eda      Dolapo Umar      Palace Guard (uncredited)  eda      Elliott Wright      Prince's Retinue Member  edaeab      Craig Mather      Townsperson (uncredited)  edafcaebaf      Alex Gillison  ]
67497,The Lovely Bones,   Abigail Salmon  febcafbe      Rachel Weisz      Jack Salmon  febcafbe      Mark Wahlberg      Grandma Lynn  febcafbed      Susan Sarandon      Susie Salmon  febcafbe      Saoirse Ronan      George Harvey  febcafbe      Stanley Tucci      Len Fenerman  febcafbe      Michael Imperioli      Lindsey Salmon  febcafbed      Rose McIver      Ruth Connors  febcafbe      Carolyn Dando      Buckley Salmon  febcafbff      Christian Thomas Ashdale      Ray Singh  febcafbf      Reece Ritchie      Holly  febcafbf      Nikki SooHoo      Brian Nelson  febcafbff      Jake Abel      Clarissa  febcafbf      AJ Michalka      Principal Caden  febcafbf      Tom McCarthy      Mr. Connors  febcafbfb      Stink Fisher      Samuel Heckler  aeeafdce      Andrew James Allen      Flora Hernandez  bfcab      Stefania LaVie Owen  ]
29072,Finding Nemo,   Marlin (voice)  feecaf      Albert Brooks      Dory (voice)  feecafd      Ellen DeGeneres      Nemo (voice)  feecaf      Alexander Gould      Gill (voice)  feecaf      Willem Dafoe      Bloat (voice)  feecaf      Brad Garrett      Peach (voice)  feecaf      Allison Janney      Gurgle (voice)  feecafc      Austin Pendleton      Bubbles (voice)  feecafc      Stephen Root      Deb / Flo (voice)  feecafc      Vicki Lewis      Jacques (voice)  feecafcd      Joe Ranft      Nigel (voice)  feecafd      Geoffrey Rush      Crush (voice)  feecaf      Andrew Stanton      Coral (voice)  feecafd      Elizabeth Perkins      Squirt (voice)  feecafd      Nicholas Bird      Mr. Ray (voice)  feecafd      Bob Peterson      Bruce (voice)  feecaf      Barry Humphries      Anchor (voice)  feecafe      Eric Bana      Chum (voice)  feecafed      Bruce Spence      Dentist (voice)  feecaf      Bill Hunter      Darla (voice)  feecaff      LuLu Ebeling      Tad (voice)  feecaff      Jordan Ranft      Pearl (voice)  ccabaf      Erica Beck      Sheldon (voice)  feecaff      Erik Per Sullivan      Fish School (voice)  afefea      John Ratzenberger  ]
98843,The Lord of the Rings: The Return of the King,   Frodo Baggins  febcaff      Elijah Wood      Gandalf the White  febcaffb      Ian McKellen      Aragorn  febcafff      Viggo Mortensen      Arwen Evenstar  febcaf      Liv Tyler      Legolas  febcaf      Orlando Bloom      Gimli & Treebeard (Voice)  febcafb      John Rhys-Davies      Sam Gamgee  febcaff      Sean Astin      Peregrin 'Pippin' Took  febcaf      Billy Boyd      Meriadoc 'Merry' Brandybuck  febcaf      Dominic Monaghan      Gollum  febcaf      Andy Serkis      Elrond  febcafb      Hugo Weaving      Bilbo Baggins  febcaf      Ian Holm      Th\ueoden King of Rohan  febcaff      Bernard Hill      \ucowyn  febcaf      Miranda Otto      Faramir  febcafb      David Wenham      \ucomer  febcaff      Karl Urban      Denethor  febcaf      John Noble      Galadriel  febcafb      Cate Blanchett      Gothmog & Witchking of Angmar  febcaff      Lawrence Makoare      King of the Dead  febcaf      Paul Norell      Deagol  febcaf      Thomas Robins      Rosie Cotton  febcafa      Sarah McLeod      Boromir  febcafa      Sean Bean      Celeborn  febcafad      Marton Csokas      saruman  ae      Christopher Lee      Gondorian Soldier   babffbf      David Aston      Damrod  bddae      Sadwyn Brophy      Damrod  bcda      Alistair Browning      Irolas  bfdee      Ian Hughes  ]
20832,The Lord of the Rings: The Two Towers,   Frodo Baggins  feacaf      Elijah Wood      Gandalf the White  feacafd      Ian McKellen      Aragorn  feacaf      Viggo Mortensen      Arwen Evenstar  feacaf      Liv Tyler      Legolas  feacaf      Orlando Bloom      Gimli / Voice of Treebeard  feacafd      John Rhys-Davies      Saruman  feacafa      Christopher Lee      Sam Gamgee  feacafa      Sean Astin      Peregrin 'Pippin' Took  feacafa      Billy Boyd      Meriadoc 'Merry' Brandybuck  feacafad      Dominic Monaghan      Gollum  feacafbd      Andy Serkis      Elrond  feacafb      Hugo Weaving      Haldir  feacafb      Craig Parker      Th\ueoden  feacafb      Bernard Hill      Gr\uedma Wormtongue  feacafc      Brad Dourif      \ucowyn  feacafc      Miranda Otto      Faramir  feacafc      David Wenham      \ucomer  feacafcd      Karl Urban      Galadriel  febcafd      Cate Blanchett      Freda  febcaf      Olivia Tennet      Boromir  febcafb      Sean Bean      Sharku / Snaga  bdeaa      Jed Brophy      Halteh  fbbcadb      Calum Gittins      Madril  bade      John Bach      Mauhur  cacadccd      Robbie Magasiva      Denethor  aae      John Noble      Morwen  caabde      Robyn Malcolm      Rohan Soldier  cabe      Bruce Phillips      Bereg  cafcafc      Raymond Trickitt      Grishnakh  ccdbeda      Stephen Ure      Ugluk  cdbeb      Nathaniel Lees      Eothain  ceb      Sam Comery      Gamling  ceacaecbca      Bruce Hopkins      H\uema  cfadbfcf      John Leigh  ]
86026,Seventh Son,   Master Gregory  feacaedd      Jeff Bridges      Mother Malkin  feacaedd      Julianne Moore      Tom Ward  feacaedd      Ben Barnes      Alice Deane  feacaeddd      Alicia Vikander      Billy Bradley  dacecaeeef      Kit Harington      Radu  ddaecaafc      Djimon Hounsou      Mam Ward  ddbda      Olivia Williams      Bony Lizzie  dddcabdaf      Antje Traue      Urag  ddedccae      Jason Scott Lee      Rogue Knight  ddfefde      David Cubitt      Old Guard  ddfcdad      Eric Keenleyside      Fisherman  ddacaaed      Thai-Hoa Le      Member of Mob  ddefdee      Carmel Amit      Prelate  dddb      Gerard Plunkett      Leader Soldier  dddb      Jim Shield      Malcom Ward  ddcabdbc      Timothy Webber      Tomb Robber  ddecaaedf      Julian Black Antelope      Strix  ddaddd      Luc Roderique      Soldier  ddcefea      Sean Carey      Grave Robber  dddcaafae      Fraser Aitcheson      Virahadra  ddfdfad      Zahf Paroo      Grave-robber  dddb      Loyd Catlett      Simon Ward  ddecaafd      Primo Allon      Cate Ward  dddbf      Lilah Fitzgerald      Little Girl  ddcabec      Taya Clyne      Innkeeper  dddd      Faustino Di Bauda      Young Guard  ddffe      Billy Wickman      Stray Dog  dddccff      Duffy      Jack Ward  ddcdcd      Marcel Bridges      Head Counselor  dddd      Yaroslav Poverlo      Priest's Wife  dddcd      Isabelle Landry      Mongolian  ddcaaed      Jason Asuncion      Noblewoman  ddacaaf      Joanne Bentley      Soldier  ddaedd      Anthony Welch      Timeless Hag  bcfa      Brenda McDonald  ]
83659,Lara Croft: Tomb Raider,   Lara Croft  feacaff      Angelina Jolie      Lord Richard Croft  feacaff      Jon Voight      Manfred Powell  feacaff      Iain Glen      Bryce  feacaffd      Noah Taylor      Alex West  feacaffa      Daniel Craig      Distinguished Gentleman  feacaffa      Richard Johnson      Hillary  feacaffad      Chris Barrie      Mr. Pimms  feacaffb      Julian Rhind-Tutt      Wilson  feacaffb      Leslie Phillips      Assault Team Leader  feacaffa      Robert Phillips      Young Lara  feacaffb      Rachel Appleton      Boothby's Auctioneer  beab      Henry Wyndham      Head Laborer  baccabf      David Cheung      Head Laborer  bacabbe      David Tse      Little Cambodian Girl  baeaf      Ayla Amiral      Aged Buddhist Monk  bfca      Ozzie Yue      Young Buddhist Monk  bafcaacee      Wai-Keat Lau      Little Inuit Girl  bbcaaed      Stephanie Burns      Ancient High Priest  bbdcaaea      Carl Chase      Imperious Woman  bbcabb      Richenda Carey      UPS Guy  bbea      Sylvano Clarke      Maid  bbeae      Anna Maria Everett      Russian Commander  decade      Olegar Fedoro  ]
12049,Transcendence,   Dr. Will Caster  febcceadf      Johnny Depp      Max Waters  febcceae      Paul Bettany      Evelyn Caster  febcceb      Rebecca Hall      Bree  febcceb      Kate Mara      Joseph Tagger  febccebd      Morgan Freeman      Agent Donald Buchanan  febcceb      Cillian Murphy      Colonel Stevens  febccebb      Cole Hauser      Martin  febccebf      Clifton Collins Jr      Bob  ceafc      Falk Hentschel      MIT Programmer  ceaaf      Kristen Rakes      Joel Edmund  fcfcaad      Cory Hardrict      Paul  fcbcaeb      Josh Stewart      Roger  fcecacf      Luce Rains      Heng  fcfacafb      Fernando Chien      Chiu  fccafe      Steven Liu      Dr. Thomas Casey  fccac      Xander Berkeley      James Thomas  fcca      Lukas Haas      Dr. Strauss  fccafe      Wallace Langham      Meth Head #  cfcdcabb      James Burnett      Meth Head #  cfdef      Sam Quinn      Red Hooded Teenager  cfeecabe      Sam Webb      Tech Conference Coordinator  cfecaba      Chris Gartin      Groupie  cfedcabae      Olivia Taylor Dudley      RIFT Hacker  cfedecab      Abe Martell      Reporter  cffafc      Lauren Sivan      BDC Greeter  cfffc      Laramie Cooley      BDC Servant  cacabe      Nancy Jeris      FBI Agent  caccaba      Colin Jones      FBI Agent  caafe      Dylan Kenin      Solar Field Worker  cadcab      Chad Brummett      Will In Hybrid  cadc      Antonio Del Prete      Will In Hybrid  cacabca      Jon Kristian Moore      Special Forces on Roof  cabc      John Trejo      Medical Lab Tech  cafcab      Darren P. Leis      RIFT Surgeon  caefad      Richard Daniel Williams      Miserable Student  cabcabd      Seth Adkins      Hybrid Townsman (uncredited)  cacabe      Jaime Powers      Nurse (uncredited)  cac      Lubella Gauna      Tech Conference Attendee (uncredited)  cafcabab      Lyn Quinn      Townswoman (uncredited)  caba      Kendra Tuthill      Berkeley Student (uncredited)  cabdcabad      Darrick Hurst  ]
80119,Jurassic Park III,   Dr. Alan Grant  fecafdf      Sam Neill      Paul Kirby  fecafd      William H. Macy      Amanda Kirby  fecafd      T\uea Leoni      Erik Kirby  fecafdb      Trevor Morgan      Billy Brennan  fecafdf      Alessandro Nivola      Mr. Udesky  fecafd      Michael Jeter      Cooper  fecafd      John Diehl      M.B. Nash  fecafdb      Bruce A. Young      Dr. Ellie Sattler  fecafdf      Laura Dern      Mark Degler  fecafd      Taylor Nichols      Ben Hildebrand  fecafdad      Mark Harelik      Enrique Cardoso  fecafdb      Julio Oscar Mechoso      Charlie  fecafdb      Blake Michael Bryan      Cheryl Logan  fecafdd      Sarah Danielle Madison      Hannah  fecafdb      Linda Park  ]
37168,Rise of the Planet of the Apes,   Will Rodman  fecaeefd      James Franco      Caroline Aranha  fecaee      Freida Pinto      Charles Rodman  bdcaaf      John Lithgow      John Landon  bdffcacdbdb      Brian Cox      Dodge Landon  bdfcacdfb      Tom Felton      Caesar  fecaee      Andy Serkis      Steven Jacobs  fecaee      David Oyelowo      Robert Franklin  fecaee      Tyler Labine      Rodney  daceb      Jamie Harris      John Hamil  eabdcfd      Ty Olsson      Douglas Hunsiker  fecaeed      David Hewlett      Irena  fecaee      Chelah Horsdal      Donnie Thompson  edcafdc      Jesse Reid      Todd Hunsiker  ebcafded      Joey Roche      Alice Hunsiker  ebecabaee      Madison Bell      Teenage Alice Hunsiker  ecfcdf      Makena Joy      Dottie  edebfacff      B.J. Harrison      Linda  efcafecd      Mattie Hawkinson      Maurice / Court Clerk  fecaee      Karin Konoval      Rocket / Bright Eyes  cbcefebd      Terry Notary      Buck  eccc      Richard Ridings      Koda  eabb      Christopher Gordon      Cornelia  fbcca      Devyn Dalton      Alpha  fffadb      Jay Caputo      Party Girl #  fabbaa      Leah Gibson      Party Girl #  edacafe      Tracy Spiridakos      SFPD #  acabeeac      Chris Shields      Scared Girl in Stairway (uncredited)  cabcac      Lauren Watson  ]
49119,The Spiderwick Chronicles,   Jared Grace / Simon Grace  fecafe      Freddie Highmore      Helen Grace  fecafeab      Mary-Louise Parker      Mulgarath  fecafea      Nick Nolte      Mallory Grace  fecafed      Sarah Bolger      Richard Grace  fecafeb      Andrew McCarthy      Aunt Lucinda Spiderwick  fecafebb      Joan Plowright      Arthur Spiderwick  fecafeaf      David Strathairn      Hogsqueal (voice)  afbcda      Seth Rogen      Thimbletack (voice)  fecafeb      Martin Short  ]
19693,A Good Day to Die Hard,   John McClane  fecaff      Bruce Willis      Jack McClane  fecafff      Jai Courtney      Komorov  fecaff      Sebastian Koch      Lucy McClane  fecaff      Mary Elizabeth Winstead      Irina  fecaffb      \ue\ub\u\uf \u\ud\u\u\u\u\uc      Alik  fcafb      Radivoje Bukvi\u      Collins  fecaff      Cole Hauser      Murphy  fecaffb      Amaury Nolasco      Chagarin  fecaffb      Sergey Kolesnikov      Anton  fbcaaff      Roman Lukn\uer      Russian Mafia Member  fecafff      Zolee Ganxsta      Prosecutor  fcafba      P\ueter Tak\uetsy      Taxi driver  fecaff      Pavel Lychnikoff      Reporter  fecafff      Megalyn Echikunwoke      Lucas  fcae      Melissa Tang      Russian Mafia Member  fecaff      Attila \ucrpa      Russian Mafia Member  fecaff      Norbert N\ufv\uenyi      Mako  ebaacadebc      Martin Hindy      Colonel  eccadbbf      Rico Simonini      (uncredited)  fecafff      Anne Vyalitsyna  ]
99668,The Alamo,   Sam Houston  feabc      Dennis Quaid      Davy Crockett  feabc      Billy Bob Thornton      James Bowie  feabcd      Jason Patric      William Travis  feabc      Patrick Wilson      Antonio Lopez de Santa Ana  feabc      Emilio Echevarr\ueda      Rosanna Travis  feabcab      Emily Deschanel      Juan Seguin  fdeaa      Jordi Moll\ue      Sgt. William Ward  fbeaab      Leon Rippy      Colonel Green Jameson  feaee      Tommy Davidson      James Bonham  faeaad      Marc Blucas      Albert Grimes  fbaea      Robert Prentiss      Micajah Autry  fceab      Kevin Page      Mial Scurlock  fdea      Joe Stevens      Captain Almeron Dickinson  feeac      Stephen Bruton      Susanna Dickinson  ffea      Laura Clifton      Private Gregorio Esparza  eada      Ricardo Chavira      Lieutenant John Forsythe  cabb      Steven Chester Prince      Juana  caf      Estephania LeBaron      Lieutenant Colonel J.C. Neill  cab      Brandon Smith      Stunning Tejana  fdcaeb      Elena Hurst  ]
65873,The Incredibles,   Bob Parr / Mr. Incredible (voice)  fecafc      Craig T. Nelson      Helen Parr / Elastigirl (voice)  fecafcb      Holly Hunter      Lucius Best / Frozone (voice)  fecafcf      Samuel L. Jackson      Buddy Pine / Syndrome (voice)  fecafc      Jason Lee      Bomb Voyage (voice)  fecafc      Dominique Louis      Newsreel Narrator (voice)  fecafcb      Teddy Newton      Jack Jack Parr (voice)  fecafcf      Eli Fucile      Jack Jack Parr (voice)  fecafc      Maeve Andrews      Dashiell 'Dash' Parr (voice)  fecafc      Spencer Fox      Violet Parr (voice)  fecafcb      Sarah Vowell      Mirage (voice)  bcaeade      Elizabeth Pe\ufa      Edna 'E' Mode (voice)  bfcfeacdb      Brad Bird      Mrs. Hogenson (voice)  fecafcc      Jean Sincere      Gilbert Huph (voice)  fecafcc      Wallace Shawn      Bernie Kropp (voice)  fecafccd      Lou Romano      Principal (voice)  fecafcd      Wayne Canney      Tony Rydinger (voice)  fecafcd      Michael Bird      The Underminer (voice)  fecafcd      John Ratzenberger      Honey (voice)  bcaecaa      Kimberly Adair Clark      Rick Dicker (voice)  bfcaebca      Bud Luckey      Additional Voices (voice)  bcaecac      Pete Docter      Additional Voices (voice)  bceabbc      Andrew Stanton      Kari (voice)  bacea      Bret 'Brook' Parker      Additional Voices (voice)  ecdcef      Mark Andrews      Additional Voices (voice)  ecdcacbfabe      Nicholas Bird      Additional Voices (voice)  ecdbcacc      Louis Gonzales      Additional Voices (voice)  ecdbcacdc      Elizabeth Greenberg      Additional Voices (voice)  ecdeecc      Ollie Johnston      Additional Voices (voice)  ecdffed      Brad Lewis      Additional Voices (voice)  ecedcaceff      Ted Mathot      Additional Voices (voice)  ececace      Jazzie Mahannah      Additional Voices (voice)  eceacacdcc      Bob Peterson      Additional Voices (voice)  ecee      Jeff Pidgeon      Additional Voices (voice)  eceacacdd      Joe Ranft      Additional Voices (voice)  ecebacacbfb      Lori Richardson      Additional Voices (voice)  ecedcacbfbd      A.J. Riebli III      Additional Voices (voice)  eceeeea      Katherine Ringgold      Additional Voices (voice)  ecfea      Stephen Schaffer      Additional Voices (voice)  ecfd      Bob Scott      Additional Voices (voice)  ecfcacdcad      Peter Sohn      Additional Voices (voice)  ecfcadbf      Frank Thomas      Additional Voices (voice)  ecfbcacdce      Pamela Gaye Walker      Additional Voices (voice)  ecfdd      Patrick Walker      Additional Voices (voice)  ecfabeab      Deirdre Warin  ]
56974,Cutthroat Island,   Morgan Adams  fefcafff      Geena Davis      William Shaw  fefcaff      Matthew Modine      Dawg  fefcaff      Frank Langella      John Reed  fefcaffb      Maury Chaykin      Ainstee  fefcafff      Patrick Malahide      Glasspoole  fefcaff      Stan Shaw      Mr. Blair  fefcaff      Rex Linn      Snelgrave  fefcaffb      Paul Dillon      Bowen  cc      Christopher Masterson      Scully  aac      Jimmie F. Skaggs      Black Harry  ca      Harris Yulin      Bishop  eac      Carl Chase      Fiddler Pirate  ffcabdde      Peter Geeves      Captain Trotter  cabee      Angus Wright      Toussant  fac      Ken Bones      Lady  cf      Mary Peach      Lieutenant  aff      Thomas Lockyer      Auctioneer  ca      Roger Booth      Mordachai Fingers  baca      George Murcell      Bartender  cffa      Simon Atherton      Executioner  ecabcf      Dickey Beer      Hastings  ffac      Christopher Halliday      Helmsman  da      Chris Johnston      Snake the Lookout  ac      Richard Leaf      Fleming  dda      Tam White      Captain Perkins  dcabde      Rupert Vansittart      Dawg's Pirate  cabd      Nick Bartlett      Dawg's Pirate  acab      David Bailie      Dawg's Pirate  bdcabe      Kwame Kwei-Armah      Dawg's Pirate  dcaafc      Ramon Tikaram      Dawg's Pirate  eacab      Christopher Adamson  ]
