movie_id,movie_title,cast
79914,Maleficent,   Maleficent  feaccafbcb      Angelina Jolie      Princess Aurora  feaccafbcaf      Elle Fanning      Stefan  feaccafbcc      Sharlto Copley      Diaval  feaccafbcdb      Sam Riley      Thistletwit  feaccafbcc      Juno Temple      Knotgrass  feaccafbcd      Imelda Staunton      Flittle  feaccafbce      Lesley Manville      Prince Phillip  feaccafbcd      Brenton Thwaites      Young Maleficent  fbffeaa      Isobelle Molloy      Queen Ulla  feaccafbccf      Miranda Richardson      Shepherd  feaccafbce      Jamie Sives      Young Stefan  feaccafbceb      Toby Regbo      King Henry  feaccafbcef      Kenneth Cranham      Princess Leila  bdeeaccdf      Hannah New      Teen Maleficent  beadc      Ella Purnell      Princess Leila's Handmaiden  eecaab      Sarah Flind      Teen Stefan  eedaf      Jackson Bews      Advisor to King Henry  eecabce      Angus Wright      Advisor to King Henry  eeeca      Oliver Maltman      Nobleman  eecabd      Gary Cargill      Nobleman  eedafb      John O'Toole      Nobleman  eecaa      Harry Attwell      Nobleman  eeee      Anthony May      Military Nobleman  eecabc      James Hicks      General  eedafd      Stephan Chase      General  eecae      Mark Caven      Servant in Wing Room  eeef      Chris Leaney      Soldier in Wood  eeacaa      Jamie Maclachlan      Aurora ( yrs.)  eeacaa      Vivienne Jolie-Pitt      Aurora ( yrs.)  eebe      Eleanor Worthington-Cox      Captain  eebcabd      John MacMillan      Farmer  eebcabee      Tim Treloar      Guard (voice)  eebcae      Peter G. Reed      Servant  eece      Marama Corlett      King Henry's Captain  eeccabd      Liam McKenna      Overseer  eecdda      Steven Cree      Fairies / Creatures (voice)  eedcabf      Sandy Fox      Narrator (voice)  eedee      Janet McTeer      Blue Suit Performer (uncredited)  eedcaaba      Karen Anderson      King Henry Soldier (uncredited)  eeedaff      Lasco Atkins      Stefans Guard (uncredited)  eeeca      James Ayling      Palace Guard (uncredited)  eefecab      Laura Black      Courtier (uncredited)  eefcae      Sophie-Anna Brough      King Henry's General (uncredited)  eefda      Alfred Camp      Young Man (uncredited)  eecaa      Raf Cross      Stefan's Guard (uncredited)  eeda      Nick Donald      Curse Voice Fairies Creatures (uncredited)  eecabf      Terri Douglas      Court Jester (uncredited)  eeddad      Damon Driver      Stefan's Soldier / Henry's Soldier (uncredited)  eecabda      Josh Dyer      Dancer (uncredited)  eeeec      Stephanie Elstob      Courtier (uncredited)  eecaeb      Ellis Fuller      Blue Suit Performer (uncredited)  eeecae      Craig Garner      King Henry's Solider (uncredited)  eeca      Alexander Gillison      Courtier (uncredited)  eecabf      Victoria Gugenheim      Courtier (uncredited)  eedac      Daniel Harland      Pixie Reader (uncredited)  eee      Kara Lily Hayworth      Soldier / Courtier (uncredited)  eeca      John Heartstone      Stefan's Soldier (uncredited)  eed      Matt Hookings      King Henry's Soldier (uncredited)  eecabe      Craig Izzard      Dancer (uncredited)  eeee      Ceri Jerome      Girl (uncredited)  eeca      Zahara Jolie-Pitt      Blue Suit Performer (uncredited)  eecabfa      Lee Edward Jones      Courtier (uncredited)  eeddb      Hrvoje Klecz      Servant (uncredited)  eeca      Alex Marek      Palace Guard (uncredited)  eeda      Jo\ueo Costa Menezes      Courtier (uncredited)  eecac      Karen Mkrtchyan      King Stefan's Army (uncredited)  eeea      Matthew John Morley      Courtier (uncredited)  eecabff      Steven John Nice      Blue Suit Performer (uncredited)  eee      Edd Osmond      Blue Suit Performer (uncredited)  eecac      Jo Osmond      King Henry's Soldier (uncredited)  eed      Andrew James Porter      Stefan's Page (uncredited)  eecabe      Guy Potter      King Stefans Guard (uncredited)  eee      Marc Rolfe      Palace Guard (uncredited)  eecaabd      Jd Roth-round      Stefan's General (uncredited)  eeeb      Julian Seager      Soldier / Courtier (uncredited)  eeca      Peter Stacey      Screen Combat Soldier (uncredited)  eeda      Daniel Stisen      Stefan Guard (uncredited)  eeacab      Richard Summers-Calvert      Young Man (uncredited)  eeacac      Leo Suter      Courtier (uncredited)  eeaef      Tom Swacha      Special action soldier (uncredited)  eeacaac      Daniel Westwood      Courtier at Christening (uncredited)  eebe      Christian Wolf-La'Moy   ]
74657,Dawn of the Planet of the Apes,   Caesar  feccafcf      Andy Serkis      Malcolm  feccafcf      Jason Clarke      Dreyfus  feccafcfd      Gary Oldman      Ellie  feccafcf      Keri Russell      Koba  cfbeafd      Toby Kebbell      Alexander  feccafcf      Kodi Smit-McPhee      Carver  feccafcf      Kirk Acevedo      Cornelia  feccafcff      Judy Greer      Rocket  feccafcf      Terry Notary      Maurice  feccafcfd      Karin Konoval      Ash  dceeecaaed      Larramie Doc Shaw      Blue Eyes  daeacb      Nick Thurston      Werner  feccafcf      Jocko Sims      Kemp  dcccaafda      Enrique Murciano      Finney  dddf      Keir O'Donnell      Grey  ddecaafdb      Lee Ross      Terry  fbcace      Lombardo Boyar      McVeigh  ddedccd      Kevin Rankin      Foster  ddaeaa      Jon Eyez      Stoned  feccafcf      Richard King      Rationer  feccafcf      Lucky Johnson      Manone  fbecac      Al Vicente      Man   fecba      Matthew James      Luca  ffb      Scott Lang      Woman  fcbb      Deneen Tyler      Officer  faafb      Mustafa Harris      Driver  ffacaae      Mike Seal      Sniper  fdcacd      J.D. Evermore      Recruit  fbcac      Chase Boltin      Cannon-Gunner  fdaa      Michael Papajohn      Old Man  fab      Thomas Rosales Jr.      Old Woman  fdb      Carol Sutton      Gun-Clinching Man  febbe      Christopher Berry  ]
13293,The Lovers,   James Stewart / Jay Fennel  feecae      Josh Hartnett      Clara Coldstream  feecae      Simone Kessell      Laura Fennel  adcabe      Tamsin Egerton      Dolly  feecae      Alice Englert      Tulaja Naik  feecaed      Bipasha Basu      Udaji  feecae      Abhay Deol      Sonubai  feecae      Tehmina Sunny      Governor of Bombay  feecaed      Shane Briant      York  feecae      Steve Nicolson      Raoji  feecae      Atul Kulkarni        efbfed      Om Puri        efbccabe      Roshan Seth      The Assassin  efccabbd      Mahesh Jadu      Allie  efecaffe      Andrea Deck      Charles Stewart  efedb      James Mackay      Jamnabai  ecabe      Aegina De Vas      Nurse Smith  ed      Anna McNiven      Mostyn  efdecabcbf      Bryan Probets      Desai  ebb      Vijay Thombre  ]
40186,47 Ronin,   Kai  feecaeacd      Keanu Reeves      Kuranosuke \udishi  feecaead      Hiroyuki Sanada      Mika  feecaead      Kou Shibasaki      Lord Kira  feecaead      Tadanobu Asano      Lord Asano  feecaeaff      Min Tanaka      Witch  feecaeadd      Rinko Kikuchi      Chikara  feecaea      Jin Akanishi      Yasuno  feecaea      Masayoshi Haneda      Hazama  feecaeab      Hiroshi Sogabe      Basho  feecaeaf      Takato Yonemoto      Horibe  fcab      Sh\ufb Nakajima      Hara  aacaade      Hiroshi Yamada      Shogun Tsunayoshi  edcabd      Cary-Hiroyuki Tagawa      Shogun's Adjutant  eecaa      Tanroh Ishida      Kapitan  fcaaea      Yorick van Wageningen      Narrator  fecaaf      Ron Bottitta      Riku  bdaedd      Natsuki Kunimoto      Tengu Lord  becac      Togo Igawa      Kira's Spy  bffdb      Akira Koieyama      Mika's Handmaiden  bfacabd      Haruka Abe      Drunk Official  babafb      Clyde Kusatsu      Guard  bbfa      Junichi Kajioka      Lead Soldier  bcac      Masashi Fujimoto      Lovecraftian Samurai  bbee      Neil Fingleton  ]
49812,Captain America: The Winter Soldier,   Steve Rogers / Captain America  fedcafad      Chris Evans      Nick Fury  fedcafa      Samuel L. Jackson      Natasha Romanoff / Black Widow  fedcafad      Scarlett Johansson      Alexander Pierce  fedcafabb      Robert Redford      Bucky Barnes / Winter Soldier  fedcafa      Sebastian Stan      Sam Wilson / Falcon  fedcafa      Anthony Mackie      Maria Hill  fedcafaa      Cobie Smulders      Brock Rumlow  fedcafa      Frank Grillo      Jasper Sitwell  fedcafacb      Maximiliano Hern\uendez      Kate / Agent   fedcafaa      Emily VanCamp      Peggy Carter  fedcafaad      Hayley Atwell      Dr. Arnim Zola  fedcafaa      Toby Jones      Smithsonian Guard  fedcafad      Stan Lee      Jack Rollins  abcf      Callan Mulvey      Councilwoman Hawley  fecafa      Jenny Agutter      Councilman Singh  feafa      Bernard White      Councilman Rockwell  fedcafad      Alan Dale      Councilman Yen  dbdcabacd      Chin Han      Senator Stern  fecaf      Garry Shandling      Georges Batroc  fedcafab      Georges St-Pierre      French Pirate #  bfcaede      Salvator Xuereb      French Pirate #  baecde      Brian Duffy      Engine Pirate  bbcaee      Zack Duhame      French Radio Pirate  bcaacb      Adetokumboh M'Cormack      Skinny Steve  bbac      Christopher George Sarris      Launch Tech #  dbed      Aaron Himelstein      Launch Tech #  bcaacd      Allan Chanes      Dr. Fine (as Gozie Agbo)  bad      Joe Russo      SHIELD Interrogator #  bad      Christopher Markus      SHIELD Interrogator #  bfcadd      Stephen McFeely      Scientist #  aeadba      Pat Healy      Scientist #  bacaeedc      Ed Brubaker      Apple Employee  baacaef      D.C. Pierson      Com Tech #  feacafa      Danny Pudi      Com Tech #  bacecaddfb      Bernie Zilinskas      Renata (as Branka Katic)  cbcaba      Branka Kati\u      Garcia  baeafe      Angela Russo-Otstot      Charlie XO  bbcada      Jon Sklaroff      Charlie Weapons Tech  bbae      Chad Todhunter      SHIELD Tech  bbbae      Abigail Marlowe      Lead SHIELD Pilot  bccae      Jeremy Maxwell      Senior SHIELD Agent  bcacfb      Emerson Brooks      SHIELD Agent  bccaefea      Evan Parke      Strike SGT. #  bccae      Ricardo Chacon      Strike SGT. #  bcaaaecf      Griffin M. Allen      Strike Agent  bcdaaf      Ann Russo      Strike Agent  bceaefc      Joe Rosalina      Strike Agent  bcfaf      Michael Debeljak      Strike Agent  bdbaef      Eddie J. Fernandez      th Floor Strike Agent  bdcae      Jody Hart      Scudder  bdcaeb      Steven Culp      Human Resources Executive  bdebcadff      Derek Hughes      Doctor  beeaafda      Wendy Hoopes      Lead EMT  becaff      Ethan Rains      CIA Instructor  becae      Dominic Rains      Capitol Hill Police  bfca      Charles Wittman      Capitol Hill Police  bfabb      Andy Martinez Jr.      FBI Agent  bfcaf      Michael De Geus      FBI Agent  bfcaf      Terence O'Rourke      Committee Member  bffac      Anne Grimenstein      Little Boy in the Smithsonian  bfcadfc      Dante Rosalina      Fury Car Voice (voice)  bfbaa      Robert Clotworthy      SHIELD Computer (voice)  bfacad      June Christopher      The Smithsonian Narrator (voice)  bfbaa      Gary Sinise      SHIELD Agent (uncredited)  beab      Dean Barlage      Dr. List (uncredited)  abcacfe      Henry Goodman      Baron Wolfgang von Strucker (uncredited)  aacafc      Thomas Kretschmann      Wanda Maximoff (uncredited)  acaec      Elizabeth Olsen      Museum Visitor (uncredited)  cfcadb      Debbie Scaletta      Pietro Maximoff (uncredited)  acafce      Aaron Taylor-Johnson  ]
33248,Shrek Forever After,   Shrek (voice)  fefcc      Mike Myers      Donkey (voice)  fefcc      Eddie Murphy      Princess Fiona (voice)  fefccb      Cameron Diaz      Puss in Boots (voice)  fefccf      Antonio Banderas      Queen (voice)  fefcd      Julie Andrews      Brogan (voice)  fefcd      Jon Hamm      King (voice)  fefcdb      John Cleese      Cookie (voice)  fefcdf      Craig Robinson      Rumpelstiltskin / Priest / Krekraw Ogre (voice)  fefce      Walt Dohrn      Gretched (voice)  fefce      Jane Lynch      Patrol Witch / Wagon Witch # (voice)  fefceb      Lake Bell      Dancing Witch / Wagon Witch # (voice)  fefcef      Kathy Griffin      Guard Witch (voice)  fefcf      Mary Kay Place      Pumpkin Witch / Palace Witch (voice)  fefcf      Kristen Schaal      Broomsy Witch (voice)  fefcfb      Meredith Vieira      Father of Butter Pants (voice)  dacabfa      Ryan Seacrest      Pinocchio / Three Pigs (voice)  dbfedb      Cody Cameron      Doris (voice)  dbefdefe      Larry King      Mabel (voice)  dccafaf      Regis Philbin      Blind Mice (voice)  ddcadd      Christopher Knights      Gingerbread Man (voice)  defdea      Conrad Vernon      Wolf (voice)  dfcabfee      Aron Warner      Ogre Baby (voice)  dfffe      Jasper Johannes Andrews      Ogre Baby (voice)  dcafbb      Ollie Mitchell      Ogre Baby / Villager Kid (voice)  dca      Miles Bakshi      Ogre Baby / Tourist Girl / Villager Girl (voice)  dfef      Nina Zoe Bakshi      Cackling Witch (voice)  ddfed      Billie Hayes      Villager Fan # (voice)  dbfaad      Jeremy Hollingworth      Villager Fan # / Ogre Gnimrach (voice)  dfded      Brian Hopkins      Royal Messenger / Magic Mirror / Geppetto (voice)  debe      Chris Miller      Tour Guide / Camp Ogre / Ogre Naysayer / Baba Witch / Melty Witch / Witch Guard # / Butter Pants (voice)  dfaad      Mike Mitchell      Villager Fan # (voice)  dcff      James Ryan      Witch / Pedestrian (voice) (uncredited)  deccade      Ashley Boettcher      Witch / Pedestrian (voice) (uncredited)  dfcabc      Danielle Soibelman      Dragon / Animals (voice) (uncredited)  df      Frank Welker  ]
36690,Tomorrowland,   Casey Newton  cdfbdbc      Britt Robertson      Frank Walker  cdfaec      George Clooney      Athena  cddc      Raffey Cassidy      Young Frank Walker  cdfddcafad      Thomas Robinson      David Nix  cdffcafbd      Hugh Laurie      Ursula  cdcafad      Kathryn Hahn      Hugo  ddbfbe      Keegan-Michael Key      Eddie Newton  deccbfc      Tim McGraw      Frank's Dad  efcbcaf      Chris Bauer      Nate Newton  efcbdec      Pierce Gagnon      Dave Clark  efcbcaebec      Matthew MacCaull      Jenny Newton  efcbdee      Judy Greer      Bus Driver  efcccafec      Matthew Kevin Anderson      Small World Operator  efccca      Michael Giacchino      Skyscraper Foreman  efccae      D. Harlan Cutshall      Young Casey Newton  efcdcafec      Shiloh Nelson      History Teacher  efcdcaedfaf      Xantha Radley      Science Teacher  efcdaea      David Nykl      English Teacher  efcdcaee      Paul McGillion      Beefy Cop  efceae      Pearce Visser      Jail Desk Jockey  eccad      Garry Chalk      Jail Punk  ece      Dagan Nish      Jetpack Dexter  eccaf      Yusuf A. Ahmed      Jetpack Buddy  edaf      Alex Barima      Jetpack Buddy  edcaff      Jedidiah Goodacre      Monorail Mother  edaeb      Kate Crutchlow      Young Astronaut  eecad      Priya Rajaratnam      Astronaut's Father  eeaf      Parm Soor      Astronaut's Mother  eedf      Leena Manro      Pickup Driver  eedf      Rick Pearce      Police Captain  efaf      Tom Butler      Deputy  efaf      Michael Rowe      Deputy  eccaeea      Tim Perez      Eiffel Tower Guard #  eaed      Patrick Sabongui      Eiffel Tower Guard #  eaafb      Romuald Hivert      Pierre Clark  eaaf      Mathieu Lardier      Jensen  eadfb      Fraser Corbett      Tough Guard  eaaef      Darren Shahlavi      Young British Recruiter  eacaf      Aidan Gemme      Guitar Player  eadeb      Takayuki Oki      GM Plant Worker  eacaff      Natasha Davidson      Haitian Woman  eaaec      Liliane Leilan Juma      Thick Glasses (uncredited)  eaaee      Paul Anthony      DQ Patron (uncredited)  eacafd      Kenia Arias      Hero Bus Patron (uncredited)  eadebb      Kimberly Arklie      World's Fair Patron (uncredited)  eacaffb      Nicholas Barrera      Dave Clark # (uncredited)  eaae      Jason Bell      Guest (uncredited)  eacaebeee      Wendy Bell      Pedestrian (uncredited)  eaaf      Aimee Bowen      Gentleman -  World Fair (uncredited)  bcca      Bradley Bowen      World's Fair Lady (uncredited)  eccae      Chrystall Friedemann      Pewdiepie (Uncredited)  fabf      Felix Kjellberg  ]
61966,Big Hero 6,   Baymax (voice)  efcaedf      Scott Adsit      Hiro Hamada (voice)  eeafdf      Ryan Potter      Tadashi Hamada (voice)  ecada      Daniel Henney      Fred (voice)  aaca      T.J. Miller      GoGo Tomago (voice)  ecaa      Jamie Chung      Wasabi (voice)  ecaac      Damon Wayans Jr.      Honey Lemon (voice)  ecada      G\uenesis Rodr\uedguez      Professor Robert Callaghan (voice)  ecadd      James Cromwell      Alistair Krei (voice)  eeafdfb      Alan Tudyk      Aunt Cass (voice)  beea      Maya Rudolph      General (voice)  dffcabffcb      Abraham Benrubi      Abigail (voice)  dfafceb      Katie Lowes      Newscaster (voice)  dfcab      Billy Bush      Desk Sergeant (voice)  dfcabf      Daniel Gerson      Yama (voice)  dfaecabffe      Paul Briggs      Yokai (voice)  ecabc      Charlie Adler      Additional Voices (voice)  ebfeafdff      Marcella Lentz-Pope      Heathcliff (voice)  eabbecff      David Shaughnessy      Additional Voice (voice)  eabcdd      Cam Clarke      Additional Voice (voice)  eabecab      Nicholas Guest      Additional Voice (voice)  eabdea      Terri Douglas      Additional Voice (voice)  eacea      Tim Mertens      Additional Voice (voice)  eabfca      Yuri Lowenthal      Additional Voice (voice)  eaccaef      Sundra Oakley      Additional Voice (voice)  eacec      Brian R. Norris      Fred's Dad (voice)  eaccab      Stan Lee      Additional Voice (voice)  eacea      Shane Sweet      Mochi (voice) (uncredited)  eacdd      Frank Welker      Additional Voice (voice)  eabdca      David Cowgill      Additional Voice (voice)  eabbdbe      Kirk Baily      Ringleader (voice)  eabbe      Charlotte Gulezian      Additional Voice (voice)  eabbddf      Reed Buck      Additional Voice (voice)  eabcdc      Roy Conli      Additional Voice (voice)  eabccaeee      Cooper Cowgill      Additional Voice (voice)  eabecaaa      Jackie Gonneau      Additional Voice (voice)  eabdcaa      Marlie Crisafulli      Additional Voice (voice)  eabeca      Bridget Hoffman      Additional Voice (voice)  eabeca      Kelly Hoover      Additional Voice (voice)  eabfca      Leah Latham      Additional Voice (voice)  eabfcaa      James Taku Leung      Additional Voice (voice)  eaccaef      Yumi Mizui      Additional Voice (voice)  eaced      Michael Powers      Additional Voice (voice)  eacca      Lynwood Robinson      Additional Voice (voice)  eacec      Josie Trinidad      Male Technician # (voice) (uncredited)  eaccaa      Dan Howell      Additional Voice (voice)  ddcaff      June Christopher  ]
44188,Wreck-It Ralph,   Wreck-It Ralph (voice)  feacbcd      John C. Reilly      Vanellope von Schweetz (voice)  feacbcdd      Sarah Silverman      Fix-It Felix (voice)  febcbce      Jack McBrayer      Sergeant Calhoun (voice)  feacbcd      Jane Lynch      King Candy (voice)  febcbced      Alan Tudyk      Taffyta Muttonfudge (voice)  febcbcf      Mindy Kaling      Markowski (voice)  febcbcf      Joe Lo Truglio      Mr. Litwak (voice)  febcbcf      Ed O'Neill      General Hologram (voice)  febcbcfd      Dennis Haysbert      Wynnchel (voice)  febcbce      Adam Carolla      Duncan (voice)  dad      Horatio Sanz      Sour Bill / Zangief (voice)  febcbd      Rich Moore      Mary (voice)  febcbd      Edie McClurg      Don (voice)  febcbd      Jess Harnell      Deanna (voice)  febcbd      Rachael Harris      Roy (voice)  febcbdd      Skylar Astin      Candlehead (voice)  dddf      Katie Lowes      Rancis Fluggerbutter (voice)  febcbce      Jamie Elman      Jubileena Bing Bing (voice)  dbcfa      Josie Trinidad      Crumbelina Di Caramello (voice)  dedbb      Cymbre Walk      Surge Protector (voice)  dbcabb      Phil Johnston      Moppet Girl (voice)  ddc      Stefanie Scott      Beard Papa (voice)  adfe      John DiMaggio      Gene / Zombie (voice)  dadcafeb      Raymond S. Persi      Cyborg (voice)  dfbfc      Brian Kesinger      Saitine (voice)  dcfddc      Martin Jarvis      Sugar Rush Announcer / Turtle (voice)  dfab      Tucker Gilmore      Kohut (voice)  dcfb      Brandon Scott      Brad (voice)  de      Tim Mertens      Tapper (voice)  dffcadfb      Maurice LaMarche      Sonic the Hedgehog (voice)  febcbdd      Roger Craig Smith      Ryu (voice)  febcbd      Kyle Hebert      Ken Masters (voice)  febcbd      Reuben Langdon      M. Bison (voice)  febcbd      Gerald C. Rivers      Clyde (voice)  dacaf      Kevin Deters      Yuni Verse (voice)  decac      Jamie Sparer Roberts      Additional Voices (voice)  dbca      Ava Acres      Additional Voices (voice)  dcdcafe      Isabella Acres      Additional Voices (voice)  dea      Bob Bergen      Additional Voices (voice)  d      David Boat      Additional Voices (voice)  dcadf      Mike Carlsen      Additional Voices (voice)  dbd      Reed Buck      Additional Voices (voice)  df      David Cowgill      Additional Voices (voice)  df      Jim Cummings      Additional Voices (voice)  dacafee      Debi Derryberry      Additional Voices (voice)  dccaba      Terri Douglas      Additional Voices (voice)  dfff      Sandy Fox      Additional Voices (voice)  dfda      Eddie Frierson      Additional Voices (voice)  dafb      Earl Ghaffari      Additional Voices (voice)  dff      Emily Hahn      Additional Voices (voice)  dadcac      Jennifer Hale      Additional Voices (voice)  dccabba      Daniel Kaz      Additional Voices (voice)  dded      Dave Kohut      Additional Voices (voice)  dfcafe      Lauren MacMullan      Additional Voices (voice)  ddcafe      Mona Marshall      Additional Voices (voice)  dacafd      Scott Menville      Additional Voices (voice)  dfa      Laraine Newman      Additional Voices (voice)  ccaba      Paul Pape      Additional Voices (voice)  dcaccd      Lynwood Robinson      Additional Voices (voice)  dbcafe      Trenton Rogers      Additional Voices (voice)  daf      Jadon Sand      Additional Voices (voice)  dbcabbc      Kath Soucie      Additional Voices (voice)  ddff      April Stewart      Additional Voices (voice)  dfcabbdd      Fred Tatasciore      Additional Voices (voice)  dff      Jennifer Christine Vera      Additional Voices (voice)  ddd      E.G. Daily  ]
43286,The Polar Express,   Hero Boy / Father / Conductor / Hobo / Scrooge / Santa Claus (voice)  fecafcc      Tom Hanks      Smokey / Steamer (voice)  fecafcc      Michael Jeter      Hero Girl (voice)  fecafccd      Nona Gaye      Lonely Boy Billy (voice)  fecafcd      Peter Scolari      Know-It-All (voice)  fecafcc      Eddie Deezen      Sister Sarah / Mother (voice)  fecafce      Leslie Zemeckis      Elf Lieutenant (voice)  fecafcdd      Steven Tyler      Red Head Girl (voice)  fecafce      Julene Renee      Toothless Boy (voice)  fecafcd      Chris Coppola      Elf General (voice)  fecafcd      Charles Fleischer  ]
96105,Independence Day: Resurgence,   Jake Morrison  dfae      Liam Hemsworth      David Levinson  dfbaf      Jeff Goldblum      President Whitmore  dfac      Bill Pullman      Patricia Whitmore  efdcaae      Maika Monroe      President Lanford  efedbcb      Sela Ward      General Adams  efdcafceda      William Fichtner      Jasmine  efecb      Vivica A. Fox      Dr. Catherine Marceaux  efbcafab      Charlotte Gainsbourg      Dr. Brakish Okun  effedc      Brent Spiner      Julius Levinson  effcaba      Judd Hirsch      Secretary of Defense  dbfdca      Patrick St. Esprit      Sam  fcad      Joey King      Dylan Hiller  effcd      Jessie Usher      Commander Jiang Lao  dcadcae      Chin Han      Rain Lao  efeffb      AngelaBaby      Lin Tang  efffda      Grace Huang      Officer Ryan Collins  eff      Ryan Cartwright      Bobby  eecdd      Garrett Wareing      Agent Matthew Travis  ecaecdca      Gbenga Akinnagbe      Daisy  efda      Mckenna Grace      Yeong  ecabcde      Ron Yuan      Secret Service Agent  ecacdb      Alice Rietveld      Floyd Rosenberg  ecabcde      Nicolas Wright      Charlie Miller  efda      Travis Tope      Lt. Ritter  ecaae      James A. Woods      General Grey  aedffcbb      Robert Loggia      Dikembe  edbce      Deobia Oparei      Jeffrey Fineman  ecaae      Travis Hammer      Dr. Isaacs  aeeacaacb      John Storey      Felix  ecaeff      Hays Wellford      Radar Officer  effbb      Sam Quinn      Aide   ecafcede      Alma Sisneros      Comms Officer  effbe      Diana Gaitirira      Parisian Office Worker  ecabd      Humberto Castro      Military Brass  edff      Richard Beal      Armand  bcdbacb      Joshua Mikel      Tech Officer  bcdcb      Monique Candelaria      Flight Officer  ecafcee      Stafford Douglas      Captain McQuaide  bcddaad      Robert Neary      Nurse  bcddb      Beth Bailey      DC Hospital Nurse  ecabfeafe      Mona Malec      Road Rage / Confrontation Driver  bcddacba      Grizelda Quintana      Kevin  bcddacbe      Lance Lim      Officer  bcdedb      Brandon K. Hampton      Ping Li  bcdeac      Kenny Leu      Jaques  dcabfbe      Joel Virgel      Prison Tech  fcaed      Jacob Browne      Prison Tech  fcaed      Matthew Munroe      Salt Flat Tech  caed      Jade Scott Lewis      Camper Henry  cabfeadda      Zeb Sanders      Camper Marcus  edaafc      Donovan Tyee Smith      African Guard  bcabfbbf      Omar Diop      Young Man  aab      Stephen Oyoung      Local Reporter  acabfb      Casey Messer      Local Reporter  abcabfbbd      J.P. Murrieta      Young Mother (uncredited)  ecb      Ava Del Cielo      Background (uncredited)  aecaaee      Leilei Chen      Flight Officer (uncredited)  bcdccaefe      Catharine Pilafas      ESD Tech (uncredited)  ecad      Katrina Kavanaugh      Marine (uncredited)  ecaeff      Jason E. Hill      Scientist (uncredited)  abdf      Sylvie Hagan      Pilot P. Goodman (uncredited)  bcdca      Evan Bryn Graves      Tug Pilot (uncredited)  e      Aaron Tyler      Voice of Sphere  cbccaae      Jenna Purdy      Bordeaux  cdfaa      Arturo del Puerto      Chinese President  cecaabb      Ben Wang      French President  cdcaaece      Nicholas Ballas  ]
