movie_id,movie_title,cast
96615,Rio 2,   Blu (voice)  fedfcaffae      Jesse Eisenberg      Jewel (voice)  fedfcaffad      Anne Hathaway      Linda (voice)  fedfcaffad      Leslie Mann      Nico (voice)  fedfcaffadd      Jamie Foxx      Eduardo (voice)  fedfcaffafd      Andy Garc\ueda      Roberto (voice)  fedfcaffbd      Bruno Mars      Nigel (voice)  fedfcaffae      Jemaine Clement      Tulio (voice)  fedfcaffae      Rodrigo Santoro      Fernando (voice)  fedfcaffaed      Jake T. Austin      Bia (voice)  fedfcaffaf      Amandla Stenberg      Tiago (voice)  fedfcaffb      Pierce Gagnon      Aunt Mimi (voice)  fedfcaffb      Rita Moreno      Gabi (voice)  dbc      Kristin Chenoweth      Luiz (voice)  bfecaeeaad      Tracy Morgan      Pedro (voice)  bacaeee      Will.i.am      Rafael (voice)  bacaed      George Lopez      Carla (voice)  bbfcaeee      Rachel Crow      Eva (voice)  bbcaeda      Bebel Gilberto      Old Bird (voice)  dab      Jason Harris      Newscaster (voice)  dccabb      Natalie Morales      Dr. Monae (voice)  caecafc      Janelle Monae  ]
49186,X2,   Charles Xavier / Professor X  fefec      Patrick Stewart      Logan / Wolverine  fefec      Hugh Jackman      Eric Lensherr / Magneto  fefecd      Ian McKellen      Ororo Munroe / Storm  fefec      Halle Berry      Jean Grey / Phoenix  fefec      Famke Janssen      Scott Summers / Cyclops  fefec      James Marsden      Raven Darkholme / Mystique  fefec      Rebecca Romijn      William Stryker  fefec      Brian Cox      Kurt Wagner / Nightcrawler  fefec      Alan Cumming      Senator Kelly  fefecd      Bruce Davison      Yuriko Oyama / Lady Deathstrike  fefec      Kelly Hu      Marie D'Ancanto / Rogue  fefecd      Anna Paquin      Bobby Drake / Iceman  fefec      Shawn Ashmore      John Allerdyce / Pyro  fefec      Aaron Stanford      Katherine \Kitty\ Pryde / Shadowcat  fefecd      Katie Stuart      Jubilee  fefeca      Kea Wong      Artie  feacab      Bryce Hodgson      Theresa Cassidy / Siryn  feacfbee      Shauna Kain      Jason   cecac      Michael Reid MacKay      Douglas Ramsey / Cypher  afdcaccbc      Layke Anderson      Piotr Rasputin / Colossus  feacbed      Daniel Cudmore      Surgeon  afdbcaccb      Michael Dougherty      Surgeon  afdcaceef      Dan Harris      Prison Security Officer (uncredited)  cfcabff      Bryan Singer      President McKenna  fefeca      Cotter Smith      White House Tour Guide  fefeca      Chiara Zanni      News Reporter  cfaec      Ted Friend      Stryker Soldier #  ffbdcaa      Aaron Douglas      Oval Office Agent Cartwright  ccacb      Roger Cross      Captured X-Kid  dddcac      Nolan Gerard Funk      Dr. Hank McCoy  bfff      Steve Bacic  ]
53282,Fast Five,   Dominic Toretto  fefcafabb      Vin Diesel      Brian O'Conner  fefcafabf      Paul Walker      Mia Toretto  fefcafac      Jordana Brewster      Roman Pearce  fefcafac      Tyrese Gibson      Tej Parker  fefcafacf      Ludacris      Vince  fefcafadb      Matt Schulze      Han Seoul-Oh  fefcafad      Sung Kang      Gisele Yashar  fefcafad      Gal Gadot      Tego Leo  fefcafbf      Tego Calder\ufn      Rico Santos  fefcafb      Don Omar      Hernan Reyes  fefcafadf      Joaquim de Almeida      Luke Hobbs  fefcafab      Dwayne Johnson      Elena Neves  fefcafacb      Elsa Pataky      Zizi  fefcafb      Michael Irby      Wilkes (as Fernando F. Chien)  fefcafbb      Fernando Chien      Fusco  fefcafbf      Alimi Ballard      Chato  fefcafb      Yorgo Constantine      Macroy  fefcafb      Geoff Meed      Chief of Police Alemeida  fefcafbb      Joseph Melendez      Rosa  fefcafbf      Jeirmarie Osorio      Capa  fefcafb      Mark Hicks      Berto  fefcafb      Esteban Cueto      Lanzo (as Corey Eubanks)  fefcafbb      Corey Michael Eubanks      Diogo (as Luis DaSilva)  fefcafbf      Luis Da Silva Jr.      Cash House Door Guard  fefcafb      Luis Gonzaga      Evidence Technician  fefcafb      Carlos Sanchez      Lead DEA Agent (as Ben Blankenship)  fefcafbb      Benjamin Blankenship      Conductor  fefcafbf      Pedro Garc\ueda      Croupier  fefcafb      Arturo Gaskins      Field Reporter  fefcafb      Jay Jackson      Field Reporter  fefcafbb      Arlene Santana      News Anchor  fefcafbf      Kent Shocknek      News Anchor  fefcafba      Sharon Tay      News Anchor  fefcafba      Andy Rosa Adler      Monica Fuentes (uncredited)  cccacf      Eva Mendes      Letty Ortiz (uncredited)  fecaff      Michelle Rodriguez  ]
85142,Sherlock Holmes: A Game of Shadows,   Sherlock Holmes  fecafba      Robert Downey Jr.      Dr. John Watson  fecafba      Jude Law      Professor James Moriarty  fcaadbb      Jared Harris      Madam Simza Heron  fecafbab      Noomi Rapace      Mary Morstan  fecafbcb      Kelly Reilly      Mrs. Hudson  fecafbcf      Geraldine James      Inspector Lestrade  fecafc      Eddie Marsan      Mycroft Holmes  caaabbece      Stephen Fry      Clarky  fecafc      William Houston      Tamas  fecafcd      Affif Ben Badra      Colonel Sebastian Moran  fecafc      Paul Anderson      Doctor Hoffmanstahl  fecafc      Wolf Kahler      Auctioneer  fecafc      Iain Mitchell      Carruthers  fecafcd      Jack Laskey      Shush Club Maitre D'  fecafc      Patricia Slater      Shush Club Maitre D'  fecafc      Karima Adebibe      Businessman  fecafc      Richard Cunningham      Hashisheen  fecafcd      Marcus Shakesheff      Cock Fight Referee  fecafca      Mark Sheals      University Student  fecafca      George Taylor      Irene Adler  fecafcaf      Rachel McAdams      Claude Ravache  cacadbfa      Thierry Neuvic      Rene Heron  cbccaafae      Laurentiu Possa      Ballroom Photographer  cacab      Carsten Hayes      Captain Tanner  cbcaebb      Clive Russell  ]
17017,Clash of the Titans,   Perseus  feecfe      Sam Worthington      Zeus  feecfead      Liam Neeson      Hades  feecfe      Ralph Fiennes      Io  feecfe      Gemma Arterton      Calibos / Acrisius  feecfe      Jason Flemyng      Andromeda  feecfe      Alexa Davalos      Danae  feecfed      Tine Stapelfeldt      Draco  feecfea      Mads Mikkelsen      Apollo  feecfea      Luke Evans      Athena  feecfea      Izabella Miko      Solon  fefcfeef      Liam Cunningham      Ixas  fefcfef      Hans Matheson      Ozal  feecfee      Ashraf Barhom      Kucuk  fefcff      Mouloud Achour      Sheikh Sulieman  fefcff      Ian Whyte      Kepheus  fefcfef      Vincent Regan      Cassiopeia  feecfedf      Polly Walker      Prokopion  fefcfeff      Luke Treadaway      Spyros  feecfedb      Pete Postlethwaite      Marmara  feecfee      Elizabeth McGovern      Bello  ebcafadba      Rory McCann      Peshet  feecfeb      Kaya Scodelario      Hermes  fefcfefb      Alexander Siddig      Poseidon  fefcfff      Danny Huston      Harbourmaster  bdeae      Phil McKee      Citizen (Argos)  bea      Laura Kachergus      Kepheus' General  bead      David Kennedy      Hera  bea      Nina Young      Hestia  bfeae      Jane March      Artemis  feecfeb      Nathalie Cox      Aphrodite  feecfeb      Agyness Deyn      Medusa  bccaedbeef      Natalia Vodianova      Demeter  bfcaedd      Charlotte Comer      Eusebios  feecfeeb      Nicholas Hoult      Aged Cassiopeia  fefcffb      Katherine Loeppky  ]
37650,Total Recall,   Douglas Quaid/Hauser  fecafeb      Arnold Schwarzenegger      Lori  fecafef      Sharon Stone      Melina  fecafea      Rachel Ticotin      Vilos Cohaagen  fecafea      Ronny Cox      Richter  fecafeab      Michael Ironside      George/Kuato  fecafeaf      Marshall Bell      Dr. Edgemar  fecafebb      Roy Brocksmith      Bob McClane  fecafebf      Ray Baker      Dr. Lull  bbfdee      Rosemary Dunsmore      Tony  bbcabccf      Dean Norris      Thumbelina  bbabddffb      Debbie Lee Carrington      Mary  bbdedee      Lycia Naff      Harry  bccabeef      Robert Costanzo      Everett  bcecabd      Marc Alaimo      Rebel Lieutenant  bccabccfcb      Michael Gregory      Burly Miner  bcbdeff      Mickey Jones      Voice of Johnnycab (voice)  bcceddaed      Robert Picardo      Helm  fecafeb      Michael Champion      Benny  fecafeb      Mel Johnson Jr.      Ernie  cefccabb      David Knell      Tiffany  ceacaba      Alexia Robinson  ]
72902,The 13th Warrior,   Ahmad Ibn Fadl\un  fecafcd      Antonio Banderas      Buliwyf  fecafce      Vladimir Kulich      Herger the Joyous  fecafce      Dennis Storh\ufi      Edgtho the Silent  fecafceb      Daniel Southern      Helfdane the Fat  fecafcef      Clive Russell      Rethel the Archer  fecafcf      Mischa Hausserman      Skeld the Superstitious  fecafcf      Richard Bremmer      Queen Weilew  fecafc      Diane Venora      Roneth  eeefcaaaf      Neil Maffin      Ragnar - Dour  efaea      John DeSantis      Haltaf - Boy  effcadd      Oliver Sveinall      Halga - Wise  effca      Asbj\ufrn 'Bear' Riis      Weath - Musician  efdeaeb      Tony Curran      Hyglak - Quarrelsome  efcad      Albie Woodington      Melchisidek  efeacb      Omar Sharif      Caravan Leader  efaacad      Erick Avari      Norseman  fadf      John Bear Curtis      Norseman  aaecacbe      Andrew Kavadas      One-Eyed Old Man  fcab      Richard Ooms  ]
78160,The Bourne Legacy,   Aaron Cross  fecafc      Jeremy Renner      Dr. Marta Shearing  fecafc      Rachel Weisz      Byer  fecafc      Edward Norton      Ezra Kramer  fecafcd      Scott Glenn      Turso  fecafc      Stacy Keach      Pamela Landy  fecafcd      Joan Allen      Dita Mandy  fecafc      Donna Murphy      Dr. Albert Hirsch  fecafc      Albert Finney      Arthur Ingram  fecafcab      Michael Chernus      #  fecafc      Oscar Isaac      Vendel  fecafc      Corey Stoll      Noah Vosen  fecafc      David Strathairn      Larry Hooper  fecafcd      Michael Papajohn      Ward  fecafc      Dennis Boutsikaris      Candent Woman #  fecafc      Sheena Colette      LARX #  fecafc      Louis Ozawa Changchien      Ray Wills  fecafcaf      Corey Johnson      Outcome #  fecafcb      Jennifer Kim      Dr. Connie Dowd  fecafcb      Elizabeth Marvel      Mackie  fecafcbb      Shane Jacobson      Mrs. Yun  fecafcbf      Page Leong      Outcome #  fecafcc      Robert Christopher Riley      Dr. Donald Foite  fecafcc      Zeljko Ivanek      boatman  afaeafbc      Lou Veloso      Philippine Pharmacist  dcaccac      Ruby Ruiz      Landlady  dcacbcaca      Madeleine Nicolas      TV Mom  dcaedb      Antonette Garcia      Citrus Samaritan  dcbcaab      Joel Torre      Joseph  decadcaec      John Arcilla      TSA Guard  ccabeb      Faye Yvette McQueen      C-Team  dbac      Rachel Black  ]
79712,Batman & Robin,   Bruce Wayne / Batman  fecaffeaf      George Clooney      Dick Grayson / Robin  fecaffefd      Chris O'Donnell      Dr. Victor Fries / Mr. Freeze  fecaffef      Arnold Schwarzenegger      Dr. Pamela Isley / Poison Ivy  fecaffef      Uma Thurman      Barbara Wilson / Batgirl  fecaffef      Alicia Silverstone      Alfred Pennyworth  fecaffeb      Michael Gough      Commissioner James Gordon  fecaffeb      Pat Hingle      Julie Madison  fecaffebf      Elle Macpherson      Dr. Jason Woodrue  fecaffebb      John Glover      Ms. B. Haven  fecaffec      Vivica A. Fox      Bane  fecafff      Robert Swenson      Banker  ccaf      Coolio      Arkham Asylum Security  ccdbf      Jesse Ventura      Arkham Asylum Security  ccddda      Ralf Moeller  ]
38601,How the Grinch Stole Christmas,   Grinch  feccafaf      Jim Carrey      Cindy Lou Who  feccafa      Taylor Momsen      Mayor Augustus Maywho  feccafa      Jeffrey Tambor      Martha May Whovier  feccafab      Christine Baranski      Lou Lou Who  feccafaf      Bill Irwin      Betty Lout Who  feccafaa      Molly Shannon      Whobris  feccafaa      Clint Howard      -Year-Old Grinch  feccafaab      Josh Ryan Evans      Clarnella  feccafaaf      Mindy Sterling      Rose  feccafab      Rachel Winfree      Elderly Timekeeper  ccaaa      Rance Howard      Drew Lou Who  feccafabb      Jeremy Howard      Stu Lou Who  feccafabf      T. J. Thyne      Christina Whoterberry  feccafac      Lacey Kohl      Junie  feccafac      Nadja Pionilla      Shopper  cbeaefc      Suzanne Krull      Narrator (voice)  eafdbf      Anthony Hopkins  ]
12720,The Day After Tomorrow,   Jack Hall  fecafa      Dennis Quaid      Sam Hall  fecafa      Jake Gyllenhaal      Laura Chapman  fecafab      Emmy Rossum      Jason Evans  fecafaf      Dash Mihok      Frank Harris  fecafa      Jay O. Sanders      Dr. Lucy Hall  fecafa      Sela Ward      J.D.  fecafab      Austin Nichols      Brian Parks  fecafaf      Arjay Smith      Janet Tokada  fecafa      Tamlyn Tomita      Parker  fecafa      Sasha Roiz      Terry Rapson  fecafab      Ian Holm      Saudi Delegate  fecafaf      Nassim Sharara      Venezuelan Delegate  fecafa      Carl Alacchi      Vice President Becker  fecafa      Kenneth Welsh      Saudi Translator  fecafab      Michel 'Gish' Abou-Samah      Bob  ccdfe      Kenneth Moskow      Luther  cdedf      Glenn Plummer      Simon  cdcefb      Adrian Lester      Gomez  cdcaafd      Nestor Serrano      Veteran Scientist  cdbcaafd      John Maclaren      Flight Director  cdcecabab      Richard Zeman      President Blake  cdecabf      Perry King      Secretary of State  cedfcf      Mimi Kuzyk      Yuri Russian Astronaut  ceefe      Vitali Makarov      Hideki Japanese Astronaut  cecabe      Russell Yuen      Vorsteen  cbe      Christopher Britton      Aaron  caccbe      Christian Tessier  ]
16171,Mission: Impossible II,   Ethan Hunt  fecaf      Tom Cruise      Sean Ambrose  fecaf      Dougray Scott      Nyah Nordoff-Hall  fecafd      Thandie Newton      Luther Stickell  fecaf      Ving Rhames      Hugh Stamp  fecaf      Richard Roxburgh      Billy Baird  fecaf      John Polson      John C. McCloy  fecafd      Brendan Gleeson      Dr. Nekhorvich  fecaf      Rade Serbedzija      Wallis  fecaf      William Mapother      Ulrich  fecaf      Dominic Purcell      Michael  fecafd      Mathew Wilkinson      Accountant  fecaf      Nicholas Bell      Flamenco Dancer  fecaf      Cristina Brogeras      Chemist  fecaf      Kee Chan      Larrabee  fecafd      Kim Fleming      Mission Commander Swanbeck  fecafa      Anthony Hopkins      Dr. Gradsky  aaadcaeef      Christian Manon  ]
92009,The Perfect Storm,   Capt. Billy Tyne  fecafacb      George Clooney      Bobby Shatford  fecafacf      Mark Wahlberg      Christina \ Chris \ Cotter  fecafad      Diane Lane      Dale \ Murp \ Murphy  fecafad      John C. Reilly      David \ Sully \ Sullivan  fecafadb      William Fichtner      Alexander McAnally III  fecafadf      Bob Gunton      Melissa Brown  fecafae      Karen Allen      Alfred Pierre  fecafae      Allen Payne      Linda Greenlaw  fecafaeb      Mary Elizabeth Mastrantonio      Mike 'Bugsy' Moran  fecafaef      John Hawkes      Edie Bailey  fecafaf      Cherry Jones      Todd Gross  fecafaf      Christopher McDonald      Bob Brown  fecafafb      Michael Ironside      Irene 'Big Red' Johnson  fecafaff      Rusty Schwimmer      Ethel Shatford  fecafb      Janet Wright      Sgt. Jeremy Mitchell  fecafb      Dash Mihok      Capt. Darryl Ennis  fecafbb      Josh Hopkins      Lt. Rob Pettit  fecafbf      Todd Kimsey      Flight Engineer Borgers  fecafb      Chris Palermo      Sgt. Millard Jones  fecafb      Wiley M. Pickett      Dale Murphy Jr.  fecafbb      Hayden Tank      Debra Murphy  fecafbf      Merle Kennedy      Alfred Pierre's Girlfriend  fecafb      Jennifer Sommerfeld      Douglas Kosco  fecafb      Joseph D. Reitman      Quentin - The Old Timer  fecafbb      Sandy Ward      Pam - Todd Gross' Assistant  fecafbf      Melissa Samuels      Commander Brudnicki  fecafb      Steven Barr      C- Pilot  deb      Billy Mayo  ]
45936,4: Rise of the Silver Surfer,   Reed Richards / Mr. Fantastic  fecafeacb      Ioan Gruffudd      Sue Richards / Invisible Woman  fecafeacf      Jessica Alba      Johnny Storm / Human Torch  fecafead      Chris Evans      Ben Grimm / The Thing  fecafead      Michael Chiklis      Victor von Doom / Doctor Doom  fecafeae      Julian McMahon      Alicia Masters  fecafeae      Kerry Washington      General Hager  fecafeaf      Andre Braugher      Norrin Radd / Silver Surfer (voice)  fecafeadf      Laurence Fishburne      Norrin Radd / Silver Surfer  fecafeadb      Doug Jones      Frankie Raye  fecafeaeb      Beau Garrett      Priest  fecafeafb      Brian Posehn      James Sherman / Rafke  baacaacb      Zach Grenier      Dr. Jeff Wagner  bafa      Kenneth Welsh      Baxter Building Doorman  badbdb      Kevin McNulty      Hot Party Girl #  eafccafd      Crystal Lowe      Johnny's Wedding Date  fecafeaef      Vanessa Lachey      Stan Lee - Rejected Wedding Guest  fecafeaf      Stan Lee      Tailor  ffaaacdb      Andy Stahl  ]
28356,Life of Pi,   Pi Patel ( /  Years)  fedbcbbc      Suraj Sharma      Pi Patel (Adult)  fedbcbbb      Irrfan Khan      Pi Patel ( /  Years)  fedbcbbc      Ayush Tandon      Pi Patel ( Years)  fedbcbbe      Gautam Belur      Santosh Patel  fedbcbbc      Adil Hussain      Gita Patel  fedbcbbbd      Tabu      Ravi Patel ( Years)  cdeabef      Ayaan Khan      Ravi Patel ( /  years)  fedbcbb      Mohd Abbas Khaleeli      Ravi Patel (/ years)  fedbcbbe      Vibish Sivakumar      Writer  fedbcbbd      Rafe Spall      Cook  fedbcbbb      G\uerard Depardieu      Older Insurance Investigator  fedbcbbd      James Saito      Younger Insurance Investigator  fedbcbbdb      Jun Naito      Priest  fedbcbbdf      Andrea Di Stefano      Anandi  fedbcbb      Shravanthi Sainath      Mamaji  fedbcbbb      Elie Alouf      Dance Master  fedbcbbf      Padmini Ramachandran      Science Teacher  fedbcbb      T.M. Karthik      Indian History Teacher  fedbcbb      Amarendran Ramanan      Librarian  fedbcbbb      Hari Mina Bala      Buddhist Sailor  feaade      Wang Bo-Chieh  ]
76398,Ghost Rider,   Johnny Blaze/Ghost Rider  feeacafcf      Nicolas Cage      Roxanne Simpson  feeacafcfd      Eva Mendes      Blackheart / Black King  feeacafc      Wes Bentley      Mack  feeacafc      Donal Logue      Carter Slade / Phantom Rider  feeacafc      Sam Elliott      Mephistopheles  feeacafcf      Peter Fonda      Barton Blaze  feeacafc      Brett Cullen      Young Johnny Blaze  feeacafc      Matt Long      Young Roxanne Simpson  feeacafcb      Raquel Alessi      Team Blaze  fcf      Tony Ghosthawk      Team Blaze  bcaa      Hugh Sexton      Team Blaze  ccaba      Marcus Jones      Team Blaze  dcaefa      Matt Norman      X Games Announcer  ecabfd      Lawrence Cameron Steele      Motorcycle Gang Member  caafa      Eddie Baroo      Broken Spoke Waitress  cab      Jessica Napier      Goth Girl in Alley  aaefd      Rebel Wilson      Wallow  deeee      Daniel Fredericsen      Abigor  df      Mathew Wilkinson  ]
