movie_id,movie_title,cast
25683,Avatar,   Jake Sully  aacaca      Sam Worthington      Neytiri  fecaccb      Zoe Saldana      Dr. Grace Augustine  fecaca      Sigourney Weaver      Col. Quaritch  fecaccf      Stephen Lang      Trudy Chacon  fecacd      Michelle Rodriguez      Selfridge  fecace      Giovanni Ribisi      Norm Spellman  fecacdd      Joel David Moore      Moat  fecace      CCH Pounder      Eytukan  fecaced      Wes Studi      Tsu'Tey  fecace      Laz Alonso      Dr. Max Patel  fecacf      Dileep Rao      Lyle Wainfleet  fecacf      Matt Gerald      Private Fike  fecacab      Sean Anthony Moran      Cryo Vault Med Tech  fecacaf      Jason Whyte      Venture Star Crew Chief  fecaca      Scott Lawrence      Lock Up Trooper  fecaca      Kelly Kilgour      Shuttle Pilot  fecacab      James Patrick Pitt      Shuttle Co-Pilot  fecacaf      Sean Patrick Murphy      Shuttle Crew Chief  fecaca      Peter Dillon      Tractor Operator / Troupe  fecaca      Kevin Dorman      Dragon Gunship Pilot  fecacab      Kelson Henderson      Dragon Gunship Gunner  fecacaf      David Van Horn      Dragon Gunship Navigator  fecaca      Jacob Tomuri      Suit #  fecaca      Michael Blain-Rozgay      Suit #  fecacab      Jon Curry      Ambient Room Tech  fecacaf      Luke Hawker      Ambient Room Tech / Troupe  fecaca      Woody Schultz      Horse Clan Leader  fecaca      Peter Mensah      Link Room Tech  fecacab      Sonia Yee      Basketball Avatar / Troupe  fecacaf      Jahnel Curfman      Basketball Avatar  fecacaa      Ilram Choi      Na'vi Child  fecacaa      Kyla Warren      Troupe  fecacaab      Lisa Roumain      Troupe  fecacaaf      Debra Wilson      Troupe  fecacabb      Chris Mala      Troupe  fecacab      Taylor Kibby      Troupe  fecacab      Jodie Landau      Troupe  fecacabf      Julie Lamm      Troupe  fecacac      Cullen B. Madden      Troupe  fecacac      Joseph Brady Madden      Troupe  fecacacb      Frankie Torres      Troupe  fecacacf      Austin Wilson      Troupe  fecacad      Sara Wilson      Troupe  fecacad      Tamica Washington-Miller      Op Center Staff  fecacadb      Lucy Briant      Op Center Staff  fecacadf      Nathan Meister      Op Center Staff  fecacae      Gerry Blair      Op Center Staff  fecacae      Matthew Chamberlain      Op Center Staff  fecacaeb      Paul Yates      Op Center Duty Officer  fecacaef      Wray Wilson      Op Center Staff  fecacaf      James Gaylyn      Dancer  fecacaf      Melvin Leno Clark III      Dancer  fecacafb      Carvon Futrell      Dancer  fecacaff      Brandon Jelkes      Dancer  fecacb      Micah Moch      Dancer  fecacb      Hanniyah Muhammad      Dancer  fecacbb      Christopher Nolen      Dancer  fecacbf      Christa Oliver      Dancer  fecacb      April Marie Thomas      Dancer  fecacb      Bravita A. Threatt      Mining Chief (uncredited)  fecacbb      Colin Bleasdale      Veteran Miner (uncredited)  fecacbf      Mike Bodnar      Richard (uncredited)  fecacb      Matt Clayton      Nav'i (uncredited)  fecacb      Nicole Dionne      Trooper (uncredited)  fecacbb      Jamie Harrison      Trooper (uncredited)  fecacbf      Allan Henry      Ground Technician (uncredited)  fecacb      Anthony Ingruber      Flight Crew Mechanic (uncredited)  fecacb      Ashley Jeffery      Samson Pilot  fecacf      Dean Knowsley      Trooper (uncredited)  fecacbb      Joseph Mika-Hunt      Banshee (uncredited)  fecacbf      Terry Notary      Soldier (uncredited)  fecacb      Kai Pantano      Blast Technician (uncredited)  fecacb      Logan Pithyou      Vindum Raah (uncredited)  fecacbb      Stuart Pollock      Hero (uncredited)  fecacbf      Raja      Ops Centreworker (uncredited)  fecacb      Gareth Ruck      Engineer (uncredited)  fecacb      Rhian Sheehan      Col. Quaritch's Mech Suit (uncredited)  fecacbb      T. J. Storm      Female Marine (uncredited)  fecacbf      Jodie Taylor      Ikran Clan Leader (uncredited)  fecacb      Alicia Vela-Bailey      Geologist (uncredited)  fecacb      Richard Whiteside      Na'vi (uncredited)  fecacbb      Nikie Zambo      Ambient Room Tech / Troupe  fecacbf      Julene Renee  ]
14531,Pirates of the Caribbean: At World's End,   Captain Jack Sparrow  fecafbd      Johnny Depp      Will Turner  fecafb      Orlando Bloom      Elizabeth Swann  fecafb      Keira Knightley      William \Bootstrap Bill\ Turner  fecafbd      Stellan Skarsg\uerd      Captain Sao Feng  fecafb      Chow Yun-fat      Captain Davy Jones  fecafb      Bill Nighy      Captain Hector Barbossa  fecafb      Geoffrey Rush      Admiral James Norrington  fecafb      Jack Davenport      Joshamee Gibbs  fecafb      Kevin McNally      Lord Cutler Beckett  fecafb      Tom Hollander      Tia Dalma  fecafb      Naomie Harris      Governor Weatherby Swann  fecafbd      Jonathan Pryce      Captain Teague Sparrow  fecafbb      Keith Richards      Pintel  fecafbd      Lee Arenberg      Ragetti  fecafb      Mackenzie Crook      Lieutenant Theodore Groves  fecafb      Greg Ellis      Cotton  edecaabc      David Bailie      Marty  fecafb      Martin Klebba      Ian Mercer  edcabbff      David Schofield      Scarlett  eeccaa      Lauren Maher      Giselle  eedf      Vanessa Branch      Mullroy  edbcaabc      Angus Barnett      Murtogg  edaf      Giles New      Tai Huang  edecaabab      Reggie Lee      Henry Turner  eacc      Dominic Scott Kay      Mistress Ching  fecafbbd      Takayo Fischer      Lieutenant Greitzer  fecafbc      David Meunier      Hadras  dccf      Ho-Kwan Tse      Clacker  edbcb      Andy Beckwith      Penrod  ecccac      Peter Donald Badalamenti II      Cotton's Parrot (voice)  edcc      Christopher S. Capp      Captain Teague  bcacab      Keith Richards      Captain Jocard  bcaeea      Hakeem Kae-Kazim      Captain Ammand  eaacaaffc      Ghassan Massoud  ]
18260,Spectre,   James Bond  fedcaeddb      Daniel Craig      Blofeld  caab      Christoph Waltz      Madeleine  ffcafaca      L\uea Seydoux      M  ecacf      Ralph Fiennes      Lucia  caaec      Monica Bellucci      Q  fedcaedd      Ben Whishaw      Moneypenny  eccacf      Naomie Harris      Hinx  febf      Dave Bautista      C  ffcaa      Andrew Scott      Tanner  ccaaeca      Rory Kinnear      Mr. White  bfdc      Jesper Christensen      Marco Sciarra  bcafcdf      Alessandro Cremona      Estrella  bcceb      Stephanie Sigman      Mexican Man in Lift  ccabdfc      Tenoch Huerta      Mexican Woman in Lift  dcabedc      Adriana Paz      Gallo  fddbaccabaca      Domenico Fortunato      Gallo's Accomplice  dcabdfbe      Marco Zingaro      Gallo's Accomplice  dadb      Stefano Elfi DiClaudia      Q's Assistant  fddcadf      Ian Bonar      Moneypenny's Boyfriend  fddccabb      Tam Williams      Blofeld's London Helicopter Pilot  fddcaa      Richard Banham      SC Police Commander  fddccfabbd      Pip Carter      SC Police Officer  fddcecaaeb      Simon Lenagan      Priest  bfefe      Alessandro Bressanello      Moreau  caadc      Marc Zinga      Vogel  caade      Brigitte Millar      Abrika  aadda      Adel Bencherif      Blofeld's Right Hand Man  fdddaab      Gediminas Adomaitis      Lorenzo  ccacee      Peppe Lanzetta      Francesco  fdddccaabb      Francesco Arca      Marco  fdddbaaad      Matteo Taranto      Palazzo Security  fddddaac      Emilio Aniba      Guerra  fdddfaac      Benito Sagredo      Businessman  fddedccc      Dai Tabuchi      Businessman  fddebcabba      George Lasha      Businessman  fddeab      Sargon Yelda      Businessman  fddefcabba      Andy Cheung      Marshall  fddebaaf      Erick Hayden      Valerian  fddeccaabc      Oleg Mirochnikov      Fiat Driver  fddefaa      Antonio Salines      Street Sweeper  fddfcc      Miloud Mourad Benamara      Chairman  fddfaabcf      Gido Schimanski      Head of Nation  fddfcaab      Nigel Barber      Head of Nation  fddffcabcd      Patrice Naiambana      Head of Nation  fddfcadadb      Stephane Cornicard      Head of Nation  fddfab      Gary Fannin      Head of Nation  fddfccaaebe      Sadao Ueda      Head of Nation  fddfbab      Phillip Law      Head of Nation  fddfefaba      Wai Wong      Head of Nation  fdeaac      Joseph Balderrama      Aide  fdecccb      Eiji Mihara      Aide  fdeaaae      Junichi Kajioka      Clinic Barman  cacecf      Victor Schef\ue      Clinic Security Guard  fdefac      Harald Windisch      Clinic Security Guard  fdecaacc      Tristan Matthiae      Cable Car Heavy  dbcaafd      Detlef Bothe      Cable Car Heavy  fdecadbf      Bodo Friesecke      Syringe Heavy  fdeacb      Wilhem Iben      Snowboarder  fdeacd      Noemi Krausz      Snowboarder  fdedcabcf      Noah Saavedra      Snowboarder  fdeac      Francis Attakpah      Snowboarder  fdeaac      Michael Glantschnig      Snowboarder  fdeaecaabcbf      Marlon Boess      Snowboarder  fdebcaaec      Marie Wohlmuth      Snowboarder  fdeccabcc      Lili Epply      Snowboarder  fdecbcaabaf      Konstantin Gerlach      L'Americain Manater  fdecabfb      Lara Parmiani      Train Guard  fdeac      Umit Ulgen      Train Waiter  fdeabf      Amra Mallassi      Train Barman  fdeac      Ziad Abaza      Blofeld's Chauffeur  fdeaac      Walid Mumuni      Blofeld's Guard  fdeebccb      Derek Horsham      Blofeld's Guard  fdeaba      Nari Blair-Mangat      Blofeld's Butler  fdecaabd      Michael White      Blofeld's Waiter  fdecac      Adam McGrady      Blofeld's Analyst  fdedacb      Nader Dernaika      Blofeld's Chief Analyst  fdefabcf      Pezhmaan Alinia      M (uncredited)  ffcabce      Judi Dench      Clinic Patron (uncredited)  bbbcaf      Neve Gachev      Businessman (uncredited)  eaeba      Karl Farrer      Lair Staff (uncredited)  edec      Kim Adis      Mexican Sprite (uncredited)  ecccaf      Maurisa Selene Coleman      Pilot David  abfcafb      Matija Mondi Matovi\u  ]
25056,The Dark Knight Rises,   Bruce Wayne / Batman  fecaf      Christian Bale      Alfred Pennyworth  fecaf      Michael Caine      James Gordon  fecaf      Gary Oldman      Selina Kyle / Catwoman  fecafd      Anne Hathaway      Bane  fecaf      Tom Hardy      Miranda Tate  fecafd      Marion Cotillard      Blake  fecaf      Joseph Gordon-Levitt      Lucius Fox  fecafd      Morgan Freeman      Dr. Jonathan Crane / Scarecrow  fecaf      Cillian Murphy      Jen  fecaf      Juno Temple      Ra's Al Ghul  fecafd      Liam Neeson      Deputy Commissioner Foley  fecafd      Matthew Modine      Dr. Pavel  fecaf      Alon Aboutboul      Daggett  fecaf      Ben Mendelsohn      The Mayor  fecaf      Nestor Carbonell      Young Ra's Al Ghul  fecaf      Josh Pence      Prisoner  fecaf      Tom Conti      Young Talia Al Ghul  fecaf      Joey King      Mercenary Security #  fecaf      Warren Brown      Captain Jones  fecaf      Daniel Sunjata      Special Ops Sergeant  fecaf      Sam Kennard      Hooded Man #  abcabba      Aliash Tepina      Caterer  abdea      Nick Julian      Maid  abbaeaf      Miranda Nolan      Maid  ccaea      Claire Julien      CIA Op  eeafdc      Aidan Gillen      Stryver  ed      Burn Gorman      Congressman  dcaeee      Brett Cullen      Ross  caea      Reggie Lee      DWP Man  caedba      Joseph Lyle Taylor      Fr. Reilly  cae      Chris Ellis      SWAT in Dive Bar  dcaedbc      Duane Henry      SWAT in Alley  ebcdf      James Harvey Ward      Cop in Manhole  ef      Gonzalo Menendez      Sewer Thug #  fca      Cameron Jack      Sewer Thug #  ecada      Lex Daniel      Mark  cdcd      Tyler Dean Flores      Doctor  dd      Thomas Lennon      Yuppie  d      Trevor White      Allen  cadd      Rob Brown      Exchange Security Chief  bd      Fredric Lehne      Female Security Guard  dcdc      Courtney Munch      Paparazzi #  aacadee      Chris Hill      Paparazzi #  afcaeb      Travis Guba      Rich Twit  accaee      Jay Benedict      Officer Simon Jansen  aadcae      Will Estes      Shoe Shine Man at GSE  acccb      David Dayan Fisher      Trader #  bcad      Glen Powell      Trader #  bcae      Russ Fega      Valet at Museum  bacae      Andres Perez-Molina      Veteran Cop  bccad      Brent Briscoe      Fredericks  becdb      John Nolan       Star Air Force General  ccaa      Oliver Cotton      Airport Cop  cdde      Mark Killeen      Analyst #  cacaedcb      Sarah Goldberg      Analyst #  ccaedcbb      John MacMillan      Army Captain at Bridge  cfcaec      Robert Wisdom      Cement Truck Driver  dcaebd      Ronnie Gene Blevins      CIA Analyst  dddd      John Hollingworth      Cop with Gordon  ddcae      Ian Bohen      Blind Prisoner  decaedce      Uri Gavriel      Ex-Prisoner at River  dffa      Noel Gugliemi      Gangbanger  dcefb      Hector Atreyu Ruiz      Huge Inmate  dfdcaeac      Patrick Cox      Kid with Apple  ecaeacc      Aramis Knight      Barsad  eac      Josh Stewart      President  ecaeea      William Devane      Skinny Prisoner  accafcc      David Gyasi      Special Forces #  aaeaf      Patrick Jordan      Mercenary at City Hall  afcaedef      Joshua Elijah Reese      Uniform  acaed      Desmond Harrington      Bomb Truck Driver  aacaea      Mychael Bates      Wayne's Lawyer  dcaedcec      Tomas Arana      Applied Sciences Tech #  caeae      Peter Holden      Applied Sciences Tech #  bcaeeca      David Monahan      Lawyer's Clerk  bbcaecaf      Jillian Armenante      Greeter at Museum  fccaeca      Aja Evans      Valet at Wayne Enterprises  caeae      Aldous Davidson      Warden at Blackgate  aafda      Wade Williams      Waiter in Florence Caf\ue  dacaede      Jake Canuso      Janitor at GSE  dcd      Massi Furlan      Mercenary Security #  dfcaedfd      Christopher Judge      Board Member #  dba      Patrick Leahy      Uniform #  dbd      Todd Gearhart      Gotham City Police Officer (uncredited)  ddfbecf      Marc Abbink      Young Stock Broker (uncredited)  caf      Isiah Adams      Gotham City Police Officer (uncredited)  cbcaed      Charlie Alejandro      Former Upscaler (uncredited)  cfcaedc      Robert Arensen      Angry Mobster / Prisoner (uncredited)  dcaee      Grant Babbitt      Gotham Rogues Fan (uncredited)  defa      Fileena Bahris      Mercenary (uncredited)  baf      Rick Bolander      Police Officer (uncredited)  bbbc      Kyle Patrick Brennan      Gotham City Police Officer (uncredited)  af      Scott Churchson      Gotham Rogues Coach (uncredited)  aeecaef      Bill Cowher      Pentagon Navy Petty (uncredited)  bbcfac      Graham Curry      Reporter (uncredited)  ddfbbc      Stephanie Domini Ehlert      Older Upscale Person (uncredited)  cacac      John Farrer      Prisoner / Thug (uncredited)  caafcacb      Frank Fata      Stock Broker (uncredited)  bca      Christopher Bryan Gomez      Thug (uncredited)  cdd      Vito Grassi      Stockbroker in Snipers Scoop - Stock Exchange (uncredited)  ecade      Michael Wren Gucciardo      Prisoner (uncredited)  ccaad      Sam Harris      Police Officer (uncredited)  cdcccf      Ed Heavey      Gotham Police Officer / Fan (uncredited)  dccac      John W. Iwanonkiw      Gordon's Cop # (uncredited)  deccdd      Cindy Jackson      Boom Operator News Crew (uncredited)  ecccdf      Daniel Jordano      Gothamite (uncredited)  ccabe      William Kania      Gotham Rogues Fan (uncredited)  f      Tiffany Kemp      Stock Broker (uncredited)  ecabbb      Sun Jae Kim      Thug (uncredited)  cabec      Hrvoje Klecz      Wall Street Broker (uncredited)  a      Alex Kruz      Gotham City Police Officer (uncredited)  afcfabd      Tyler La Marr      Thug (uncredited)  acabc      LeJon      Gotham City Police Officer (uncredited)  afcabd      Paul Jude Letersky      Prisoner (uncredited)  aecabe      Joe Lipari      Tourist (uncredited)  acabc      Silvia Lombardo      Gotham Rogues Fan (uncredited)  adbda      Jorge Mardel      Gotham Rogues Fan (uncredited)  adaba      Cale McConnell      Gotham City Police Officer (uncredited)  adccabdb      David Dale McCue      Gotham Rogues Fan (uncredited)  adf      Tiffany Sander McKenzie      Angry Mobster (uncredited)  adfa      Allen Merritt      Wayne Enterprises Security (uncredited)  adacabdb      Olan Montgomery      Mercenary (uncredited)  adcdcabdbb      Alex Moore      Gotham City Police Officer (uncredited)  bb      Shane Nolan      Prisoner / Thug (uncredited)  bbacab      Jackson Nunn      Gotham City News Cameraman (uncredited)  bbecabef      Joseph O'Brien      Prison Guard (uncredited)  dddadd      Michael Papajohn      Prisoner / Mob (uncredited)  ddafcabbbf      Salomon Passariello      Gotham Stock Trader (uncredited)  dfc      Kyle David Pierce      Gotham Rogues Player (uncredited)  dfcbb      Troy Polamalu      Gotham Police Officer (uncredited)  dfcfd      Michael Power      Thug (uncredited)  ebf      James Rawlings      Doris in Black (uncredited)  eeada      Kirsten Roeters      Gotham Rogues Player (uncredited)  ea      Ben Roethlisberger      Gotham Police Officer (uncredited)  eaadba      Mark Roman      Thug (uncredited)  edaaab      Anthony J. Sacco      Angry Thug (uncredited)  edccabcaa      Eric Salazar      Hot Football Fan (uncredited)  edcabcbed      Emily Schooley      Gotham Rogues Owner (uncredited)  fbfcabcdca      Thomas Tull      Thug (uncredited)  fbfdcabef      Chris Vaina      Prisoner (voice) (uncredited)  fbffabbeee      Vincent van Ommen      Gotham City Press (uncredited)  fcabbf      Michelle Vezzani      Gotham Rogues Fan (uncredited)  fcafd      Barbara Vincent      Gotham City Police Officer (uncredited)  bcabe      Justin Michael Woods      Mercenary Soldier (uncredited)  eceaf      Jason Yee      Gotham Citizen (uncredited)  fcabce      Maria Zambrana      Gotham City Police Officer (uncredited)  cec      John Zion      Thug (uncredited)  cabda      Alex Ziwak      Gotham City Police Officer (uncredited)  bbacabcc      Tommy Bayiokos      Football Fan (uncredited)  ccaec      Matthew Gooley      Cop (uncredited)  cdddddfc      Jeff Moffitt      Football Fan (uncredited)  bacaced      Mark Falvo      Thug (uncredited)  bee      Diogo Hausen      Prisoner (uncredited)  cacafb      Gary Sievers      Mercenary (uncredited)  dfbdeac      Orion McCabe      Court Room Thug (uncredited)  afccaa      London May      Gothamite (uncredited)  ccaa      James Quinn      Thug # in Basement  ccaa      Daniel Newman  ]
99197,John Carter,   John Carter  feacafea      Taylor Kitsch      Dejah Thoris  feacafeab      Lynn Collins      Sola  feacafea      Samantha Morton      Tars Tarkas  feacafead      Willem Dafoe      Tal Hajus  feacafead      Thomas Haden Church      Matai Shang  feacafea      Mark Strong      Tardos Mors  feacafea      Ciar\uen Hinds      Sab Than  feacafea      Dominic West      Kantos Kan  feacafea      James Purefoy      Powell  feacafea      Bryan Cranston      Sarkoja  feacafead      Polly Walker      Edgar Rice Burroughs  feacafea      Daryl Sabara      Stayman # / Helm  feacafea      Arkie Reece      Stayman #  feacafea      Davood Ghadami      Lightmaster  feacafead      Pippa Nixon      Thern #  efcaad      James Embree      Thern #  cfcaf      Philip Philmar      Pretty Woman in NYC Doorway  fb      Emily Tierney      Telegraph Clerk  fda      Edmund Kente      Dalton  facaade      Nicholas Woodeson      Stable Boy  ffbbe      Kyle Agnew      Dix the Storekeeper  faeca      Don Stark      Rowdy #  cadc      Josh Daugherty      Rowdy #  cdaf      Jared Cyr      Stockade Guard  eadcf      Christopher Goodman      Sarah Carter  dcc      Amanda Clayton      Apache # (as Joe Billingiere)  adcbfae      Joseph Billingiere  ]
